id,text
d7_s22,"On the above facts, the question is: Whether there has been any infraction of the guarantee under Article 22(5) of the Constitution as a result of Central Government's omission to consider the detenu's representation independent of its consideration by the Advisory Board? The Central Government's stand is that the detenu's representation being addressed to the Advisory Board to which it was submitted during pendency of the reference before the Advisory Board, there was no obligation on the Central Government also to consider the same independently since the representation was not addressed to the Central Government."
d7_s23,"The Constitutional mandate in Article 22(5) was considered recently by a Constitution Bench in K.M. Abdulla Kunhi and B.L. Abdul Khader vs Union of India and Ors., State of Karnataka and Ors., JT 1991 (1) SC 216 1991 Indlaw SC 473, in view of some conflict in earlier decisions of this Court regarding the detaining authority's obligation to consider the detenu's representation independently of the Advisory Board's duty in this behalf."
d7_s24,The Constitution Bench held as follows:
d7_s25,"It is now beyond the pale of controversy that the constitutional right to make representation under clause (5) of Article 22 by necessary implication guarantees the constitutional right to a proper consideration of the representation."
d7_s26,"Secondly, the obligation of the Government to afford to the detenu an opportunity to make representation is distinct from the Government's obligation to refer the case of detenu along with the representation to the Advisory Board to enable it to form its opinion and send a report to the Government."
d7_s27,"It is implicit in clauses (4) and (5) of Article 22 that the Government while discharging its duty to consider the representation, cannot depend upon the views of the Board on such representation."
d7_s28,It has to consider the representation on its own without being influenced by any such view of the Board.
d7_s29,The obligation of the Government to consider the representation is different from the obligation of the Board to consider the representation at the time of hearing the references.
d7_s30,The Government considers the representation to ascertain essentially whether the order is in conformity with the power under the law.
d7_s31,"The Board, on the other hand, considers the representation and the case of the detenu to examine whether there is sufficient case for detention."
d7_s32,The consideration by the Board is an additional safeguard and not a substitute for consideration of the representation by the Government.
d7_s33,"The right to have the representation considered by the Government, is safeguarded by cl. (5) of Article 22 and it is independent of the consideration of the detenu's case and his representation by the Advisory Board under cl. (4) of article 22 read with Section 8(c) of the Act. (See: Sk."
d7_s34,"Abdul Karim & Ors. vs State of West Bengal, [ 1969] 1 SCC 433 1969 Indlaw SC 262; Pankaj Kumar Chakrabarty & Ors. vs State of West Bengal, [1970]1 SCR 543 1969 Indlaw SC 128; Shayamal Chakraborty vs The Commissioner of Police Calcutta and Anr., [ 1969] 2 SCC 426 1969 Indlaw SC 132; B. Sundar Rao and Ors. vs State of Orissa, [ 1972] 3 SCC 1 1 1971 Indlaw SC 856; John Martin vs State of West Bengal, [1975] 3 SCR 2 1 1 1975 Indlaw SC 603; section K. Sekawat vs Stale of West Bengal, [1975] 2 SCR 161 1974 Indlaw SC 148 and Haradhan Saha & Anr. vs State of IVest Bengal and Ors., [1975] 1 SCR 778 1974 Indlaw SC 360)."" (emphasis supplied)"
d7_s35,It is thus clear that the obligation of the Government to consider the representation is different and in addition to the obligation of the Board to consider it at the time of hearing the reference before giving its opinion to the Government.
d7_s36,Consideration of the representation by the Government has to be uninfluenced by the view of the Advisory Board.
d7_s37,"In short, the detenu's right to have the representation considered by the Government under Article 22(5) is independent of the consideration of the detenu's case and his representation by the Advisory Board."
d7_s38,This position in law is also not disputed before us.
d7_s39,"The learned Solicitor General, however, contended that in the present case there being no representation addressed to the Central Government, the only representation made by the detenu being addressed to the Advisory Board during pendency of the reference, there was in fact no representation of the detenu giving rise to the Central Government's obligation to consider the same."
d7_s40,The question is: Whether this contention can be accepted in the face of the clear mandate in Article 22(5) of the Constitution?
d7_s41,"It is undisputed that if there be only one representation by the detenu addressed to the detaining authority, the obligation arises under Article 22(5) of its consideration by the detaining authority independent of the opinion of the Advisory Board in addition to its consideration by the Advisory Board while giving its opinion."
d7_s42,"In other words, one representation of the detenu addressed only to the Central Government and not also to the Advisory Board does not dispense with the requirement of its consideration also by the Advisory Board."
d7_s43,"The question, therefore, is: Whether one of the requirement of consideration by Government is dispensed with when the detenu's representation instead of being addressed to the Government or also to the Government is addressed only to the Advisory Board and submitted to the Advisory Board instead of the Government? On principle, we find it difficult to uphold the teamed Solicitor General's contention which would reduce the duty of the detaining authority from one of substance to mere form."
d7_s44,The nature of duty imposed on the detaining authority under Article 22(5) in the context of the extraordinary power of preventive detention is sufficient to indicate that strict compliance is necessary to justify interference with personal liberty.
d7_s45,It is more so since the liberty involved is of a person in detention and not of a free agent.
d7_s46,"Article 22(5) casts an important duty on the detaining authority to communicate the grounds of detention to the detenu at the earliest to afford him the earliest opportunity of making a representation against the detention order which implies the duty to consider and decide the representation when made, as soon as possible."
d7_s47,"Article 22(5) speaks of the detenu's 'representation against the order', and imposes the obligation on the detaining authority."
d7_s48,"Thus, any representation of the detenu against the order of his detention has to be considered and decided by the detaining authority, the requirement of its separate consideration by the Advisory Board being an additional requirement implied by reading together clauses (4) and (5) of Article 22, even though express mention in Article 22(5) is only of the detain ing authority."
d7_s49,"Moreover, the order of detention is by the detaining authority and so also the order of its revocation if the representation is accepted, the Advisory Board's role being merely advisory in nature without the power to make any order itself."
d7_s50,"It is not as if there are two separate and distinct provisions for representation to two different authorities viz. the detaining authority and the Advisory Board, both having independent power to act on its own."
d7_s51,"It being settled that the aforesaid dual obligation of consideration of the detenu's representation by the Advisory Board and independently by the detaining authority flows from Article 22(5) when only one representation is made addressed to the detaining authority, there is no reason to hold that the detaining authority is relieved of this obligation merely because the representation is addressed to the Advisory Board instead of the detaining authority and submitted to the Advisory Board during pendency of the reference before it."
d7_s52,It is difficult to spell out such an inference from the contents of Article 22(5) in support of the contention of the learned Solicitor General.
d7_s53,"The contents of Article 22(5) as well as the nature of duty imposed thereby on the detaining authority support the view that so long as there is a representation made by the detenu against the order of detention, the aforesaid dual obligation under Article 22(5) arises irrespective of the fact whether the representation is addressed to the detaining authority or to the Advisory Board or to both."
d7_s54,The mode of address is only a matter of form which cannot whittle down the requirement of the Constitutional mandate in Article 22(5) enacted as one of the safeguards provided to the detenu in case of preventive detention.
d7_s55,"We are, therefore, unable to accept the only argument advanced by the learned Solicitor General to support the detention."
d7_s56,"On this conclusion, it is not disputed that there has been a breach by the Central Government of its duty under Article 22(5) of the Constitution of India to consider and decide the representation independently of the Advisory Board's opinion."
d7_s57,"The order of detention dated 25.1.1990 as well as the order dated 24.4.1990 of its confirmation passed by the Central Government are, therefore, quashed."
d7_s58,"This shall not, however, affect the detenu's prosecution for the alleged offence and it shall also not be construed as a direction to release him in case he is in custody as a result of refusal of bail."
d7_s59,"The writ petition is allowed, accordingly."
d7_s60,Pettion allowed
d8_s1,"All the above writ petitions have been filed by the doctors who after passing the M.B.B.S. examination, appeared for the Post Graduate Medical Entrance Examination (PGMEE) held by the Lucknow University in the year 1992, but remained unsuccessful as they secured less than 50% marks which were necessary for the students of general category and 40% marks for SC/ST according to the rules for admission applicable for Post Graduate course."
d8_s2,On 14.7.1992 we passed a detailed order and so far as the admission rules fixing 50% of the marks to be obtained at the entrance examination as minimum qualifying marks for admission to the Post Graduate medical courses are concerned the same were held to be legal and it was further held that no exception can be taken to the same.
d8_s3,"It was however, contended on behalf of the petitioners that as a result of the application of the aforesaid rule a large number of seats have remained vacant and in view of the observations made in Dr. Ambesh Kumar etc. etc., vs Principal, LLRM Medical College Meerut and Ors. etc. etc. [1987] 1 SCR 6611986 Indlaw SC 245 such a situation must be avoided and the remaining seats should be filled up by applying different criteria, the cases were postponed for further hearing."
d8_s4,We have heard learned cousel for the parties and have thoroughly gone through the record.
d8_s5,"So far as the validity of the admission rules fixing 50% marks for the general category candidates and 40% marks for the SC/ST category candidates to be obtained at the entrance examination as minimum qualifying marks for being eligible for admission to the Post Graduate medical courses, the same are not subject to any challenge as we have already held the same to be legal in our order dated 14.7.1922."
d8_s6,"Learned counsel for the petitioners made strenuous effort to persuade us to take a different view, but they failed in the said attempt."
d8_s7,"It may be further mentioned that this Court in Ajay Kumar Agrawal and Others. vs State of U.P. and others, [1991] 1 SCC 636 1990 Indlaw SC 574 observed as under :"
d8_s8,"It is not disputed that in Uttar Pradesh the prevailing practice was a 50 per cent for allowing Post Graduate Study to doctors with MBBS qualifications but taking their University examination as the base without any separate selection test, it is not the case of any of the parties before us that the selection is bad for any other reason."
d8_s9,"We are of the view that it is in general interest that the 50 per cent cut off base as has been adopted should be sustained."""
d8_s10,"The matter again came up for consideration before this Court and in State of Uttar Pradesh and Others vs Dr. Anupam Gupta etc., AIR 1992 S.C. 932 1992 Indlaw SC 334, it was held as under :"
d8_s11,"Thus it could be seen that this Court consistently laid down the criteria for conducting entrance examination to the post graduate degree and diploma courses in Medicine and the best among the talented candidates would be eligible for admission. 50% cut off marks was also held to be valid to achieve excellence in post graduate speciality."
d8_s12,Accordingly we uphold the prescription of 50% cut off marks to general candidates and 40% to SCs and STs together with 1.65% weightage of total marks i.e. 50 marks in total in entrance examination as constitutional and valid.
d8_s13,"Thus, we further hold that any challenge to the above rule laying down minimum percentage of marks for eligibility for admission to Post Graduate courses is no longer res integra."
d8_s14,"Learned counsel appearing for the petitioners then submitted that admittedly there were 439 seats available in the General category, out of which only 300 candidates secured minimum qualifying marks i.e. 50% marks and 139 seats are lying vacant."
d8_s15,Similarly in case of reserved category for SC/ST there were 96 seats out of which only 18 candidates secured 40% minimum qualifying marks and as such 78 seats are lying vacant.
d8_s16,It has been contended that in all 217 seats are lying vacant and large number of Professors and Readers meant for imparting teaching in the various disciplines of Post Graduate courses shall remain idle and the Government shall have to unnecessarily spend large funds for meeting their emoluments.
d8_s17,It was also submitted that there is a great dearth of Post Graduate doctors in the country and it would not only be a sheer wastage of money in paying salaries and other emoluments to the teachers but also in the maintenance and upkeep of infra structure available for teaching in the various disciplines of Post Graduate Courses.
d8_s18,It has been further submitted that it would not only be in the interest of the petitioners but also in the national interest if the vacant seats are filled by lowering the minimum percentage of qualifying marks in the entrance examination.
d8_s19,It has been submitted that the number of seats lying vacant is not small but it is large being 217 out of the total 535 seats.
d8_s20,"Learned counsel for the petitioners is this regard placed reliance on the following observations made by this Court in Dr. Ambesh Kumar etc. etc. vs Principal LLRM Medical College Meerut and Ors. etc. etc., [1987] 1 SCR 661 1986 Indlaw SC 245."
d8_s21,"It is pertinent to mention in this connection that the number of seats allotted to each of the prescribed courses is on the basis of two seats per professor and there is a crying necessity in the State for more experts in various disciplines in Medicine and Surgery etc."
d8_s22,It is incumbent on the State Government to see that all these seats earmarked for each of these disciplines or courses are filled up.
d8_s23,It appears from Annexure D to the petition in C.A. no. 6119 of 1983 that quite a considerable number of seats in various disciplines were kept vacant as the applicants did not fulfill the eligibility qualification framed by the State Government by its aforesaid order and as a result several Professors and Assistant Professors who are meant for imparting teaching in these disciplines were kept idle though a considerable fund had to be expended for meeting their emoluments.
d8_s24,"It is for the State to consider and to see that the seats are filled up in all the disciplines and they are not left vacant in spite of a large number of applicants applying for admission in the various disciplines and the State Government has to evolve such criteria of eligibility that all the seats in different M.D., M.S. degree and diploma courses are filled up""."
d8_s25,We have given our thoughtful consideration to the aforesaid submission.
d8_s26,It may be noted that the aforesaid rule of minimum qualifying marks for admission to Post Graduate courses was in vogue for the last many years and large number of seats remained vacant in earlier years also.
d8_s27,It was for the State Government to have taken note of such situation and to have amended the rules for admission so as to fill all the seats available for Post Graduate courses.
d8_s28,"So far as any mandamus or direction to be given by this Court is concerned, we refrain from doing so because this Court has repeatedly held that the rule laying down minimum qualifying marks for admission to Post Graduate medical courses is legal and no exception can be taken to the same."
d8_s29,Even in Dr. Ambesh Kumar's case 1986 Indlaw SC 245 (supra) the rule laying down minimum of 55% and 52% marks in MBBS respectively of admission to Post Graduate degree and diploma courses was held to be valid.
d8_s30,"An argument was raised in the aforesaid case that the State Government had no power to lay down further eligibility qualification for being considered for admission in the Post Graduate courses, in addition to the eligibility criteria laid down by the Medical Council in its regulations but the aforesaid contention was negatived and it was held as under :"
d8_s31,"The order in question merely specifies a further eligibility qualification for being considered for selection for admission to the post graduate courses (degree and diploma) in the Medical Colleges in the State in accordance with the criteria laid down by Indian Medical Council."
d8_s32,This does not in any way encroach upon the Regulations that have been framed under the provisions of section 33 of the Indian Medical Council Act.
d8_s33,"On the other hand in order to promote and further the determination of standards in institutions for higher education, the State Government who runs these colleges provide an additional eligibility qualification."""
d8_s34,"Thus, we are clearly of the view that once having held that the rule prescribed by the State Government laying down minimum qualifying marks in the entrance examination is valid and the State Government having followed the aforesaid rule in granting admission in Post Graduate courses, it cannot be held that such action is illegal."
d8_s35,There is no infringement of any legal right much less of any fundamental right of the petitioners.
d8_s36,We can only recommend that the State Government may take suitable step for redressing the long felt grievance of the doctors to fill up all the vacant seats for Post Graduate courses and which would be a step in the larger public interest also.
d8_s37,"The State Government may do so for admission to Post Graduate courses for 1992 and in that case, the State Government would take immediate steps without any loss of time so that the candidates may also join the 1992 academic session for Post Graduate studies without any disadvantage."
d8_s38,It is further made clear that in doing so such candidates who having secured more than 50% marks and having already been allotted the specialities would not be disturbed in any manner.
d8_s39,The vacant seats would however be filled strictly in accordance with merit in the entrance examination and according to the combined merit list of the whole State of Uttar Pradesh.
d8_s40,The State Government would be free to issue fresh order relaxing the requirement of minimum marks to such extent which may meet the necessity of maintaining academic standards for admission to Post Graduate courses as well as regulations the prescribed by the Medical Council of India in this regard.
d8_s41,"This, in our view, would be perfectly within the powers of the State Government and would not be violative of article 14 of the Constitution."
d8_s42,The above observations relate only in respect of the vacant seats of Post Graduate courses of 1992 and not in relation to any vacancies for the earlier years of 1990 or 1991.
d8_s43,"With the aforesaid observations, we dismiss all these petitions with no order as to costs."
d8_s44,The application for intervention No.2 in Writ Petition No.454 of 1992 also stands dismissed automatically.
d8_s45,Petitions dismissed.
d9_s1,"This appeal, by special leave, has been preferred against the judgment and order dated 23 February 2005 of Bombay High Court (Aurangabad Bench), by which the appeal preferred by the appellants was dismissed and their conviction under Section 304 B read with Section 34 IPC and sentence of 7 years RI imposed thereunder by the learned Sessions Judge, Aurangabad, was affirmed."
d9_s2,The deceased Bhimabai was daughter of PW.1 Tukaram Eknath Tambe resident of village Sanjkheda and she was married to appellant no. 1 Appasaheb son of Sheshrao Palaskar about two and half years prior to the date of incident which took place on 15 September 1991.
d9_s3,"The appellant no. 2, Kadubai is the mother of the appellant no. 1 and both the appellants were residing in the same house in village Palshi."
d9_s4,"According to the case of prosecution, a sum of rs. 5000 and some gold ornaments had been given at the time of marriage of Bhimabai."
d9_s5,"For about six months Bhimabai was treated well but thereafter the accused started asking her to bring rs. 1,000 1,200 from her parents to meet the household expenses and also for purchasing manure."
d9_s6,"Whenever Bhimabai went to her parental home, she used to tell her parents that her husband and mother in law (accused appellants) were harassing her and used to occasionally beat her."
d9_s7,Her father PW.1 Tukaram along with some of his relatives went to the house of the accused and tried to persuade them not to ill treat Bhimabai.
d9_s8,"Thereafter, the accused treated Bhimabai properly but after about four months they again started harassing her."
d9_s9,"A few days before Nag Panchami festival Bhimabai came to her parental home and complained that the accused were not giving her proper food, clothing and even footwear."
d9_s10,"She also told her parents that her husband had asked her to bring an amount of Rs.1,000 1,200 for the purpose of household expenses and manure."
d9_s11,The case of the prosecution futher is that in the evening of 15 September 1991 a person came from village Palshi on a motorcycle and informed PW.1 Tukaram that Bhimabai was unwell.
d9_s12,PW.1 then immediately went to the house of the accused along with some of his relatives.
d9_s13,There he saw that Bhimabai was lying dead and froth was coming out of her mouth which indicated that she had consumed some poisonous substance.
d9_s14,The Police Patil of the village PW.3 Sandu Mohanrao Patil lodged an accidental death report at 9.00 p.m. on 15 September 1991 at the police station.
d9_s15,"On the basis of the said accidental death report, PW.6 Sandeepan Kamble, Police Sub Inspector, visited the house of the accused, held inquest on the dead body of Bhimabai, and thereafter sent the same for post mortem examination."
d9_s16,"PW.1 Tukaram lodged the FIR of the incident at 7.00 p.m. on 16 September 1991 at P.S. Chikalthana, on the basis of which Case Crime no. 144 of 1991 was registered against the appellants under Sections 498 A, 306 and 304 B IPC."
d9_s17,"After completion of investigation, charge sheet was submitted against the appellants and in due course, the case was committed to the Court of Sessions."
d9_s18,"The learned Sessions Judge framed charges under Sections 498 A, 304 B read with Section 34 IPC and Section 306 read with Section 34 IPC against both the appellants."
d9_s19,The appellants pleaded not guilty and claimed to be tried.
d9_s20,The prosecution in order to establish its case examined six wintesses and filed some documentary evidence.
d9_s21,The learned Sessions Judge after consideration of the material on record acquitted the appellants of the charges under Sections 498 A and 306 read with Section 34 IPC but convicted them under Section 304 B IPC and imposed a sentence of 7 years RI thereunder.
d9_s22,The appeal preferred by the appellants was dismissed by the High Court by the judgment and order dated 23 February 2005.
d9_s23,"We have heard learned counsel for the appellants, learned counsel for the State of Maharashtra and have perused the records."
d9_s24,"The post mortem examination on the body of deceased Bhimabai was conducted by a team of two doctors of Department of Forensic Medicine and Toxicology, Medical College, Aurangabad, namely, Dr. S.M. Jawale and Dr. H.V. Godbole on 16 September 1991."
d9_s25,"The doctors did not find any sign of external or internal injury on the body of the deceased and in their opinion, the cause of death was insecticide poisoning."
d9_s26,The viscera were preserved for chemical analysis.
d9_s27,The report of the post mortem examination was admitted by the defence.
d9_s28,The specific case of the prosecution is that Bhimabai ended her life by consuming poison because of harassment caused to her by the appellants for or in connection with demand of dowry.
d9_s29,"It is, therefore, necessary to briefly examine the evidence of the prosecution witnesses. PW. 1 Tukaram, father of the deceased, has given details of the prosecution version of the incident in his statement in Court."
d9_s30,"He has deposed that in the marriage he had given rs. 20,000 as dowry."
d9_s31,"Initially, Bhimabai was treated well for about six months, but thereafter the appellants started ill treating her."
d9_s32,"Whenever Bhimabai came to her parental home, she used to complain that for some domestic reasons she was being harassed."
