id,text
d5_s61,But no hard and fast rule that 'delay exceeding two years in the execution of a sentence of death should be considered sufficient to entitle the person under sentence of death to invoke article 21 and demand the quashing of the sentence of death' can be laid down as has been done in Vatheeswaran's case (supra).
d5_s62,"It is not necessary, therefore, to go into the aspect of this matter any more."
d5_s63,Chief Justice Chandrachud observed that a self imposed rule should be followed by the executive authority rigorously that every mercy petition should be disposed of within a period of three months from the date on which it was received.
d5_s64,"Long and interminable delay in the disposal of these petitions, it was observed, are serious hurdles in the dispensation of justice and indeed, such delays tend to shake the confidence of the people in the very system of justice."
d5_s65,"The learned Chief Justice stated that undoubtedly, the executive has the power, in appropriate cases, to act under the aforesaid provisions but, all exercise of power is preconditioned by the duty to be fair and quick."
d5_s66,"Delay defeats justice, it was observed."
d5_s67,"In this background, we have to consider the reasons given in the affidavit in this case."
d5_s68,We have set out the reasons advanced on behalf of the Government.
d5_s69,They are self explanatory.
d5_s70,"These do not, in our opinion, indicate any justifiable ground for keeping the Mercy Petitions of Daya Ram and Gyasi Ram pending for such a long time."
d5_s71,"Indeed, it is not disputed from the affidavit of the Under Secretary, Ministry of Home Affairs, Government of India that in the half yearly return Dt. 8 October 1985 and thereafter in the successive half yearly returns of the Uttar Pradesh Government upto 16 January 1989 year after year, the Mercy Petitions of Daya Ram remained unattended and undisposed of and consequently the Mercy Petition made to the President of India by Gyasi Ram was also undisposed."
d5_s72,The time and the manner in which the Mercy Petition has been dealt with in this case in respect of Gyasi Ram make sad reading and speak of the deplorable lack of speed and promptitude which in these matters should be there.
d5_s73,"In the meantime, there is no denying the fact that Gyasi Ram has suffered a great deal of mental pain and agony."
d5_s74,His condition has been described by the learned Sessions Judge as indicated hereinbefore.
d5_s75,"Whether death sentence is the appropriate punishment for the crime of murder, cold blooded in certain cases, is another debate."
d5_s76,This Court in Bachan Singh v.
d5_s77,"State of Punjab, [1983] 1 SCR 145 at page 221 of the report, observed as follows:"
d5_s78,"To sum up, the question whether or not death penalty serves any oenological purpose is a difficult, complex and intractable issue."
d5_s79,"It has evoked strong, divergent views."
d5_s80,"For the purpose of testing the Constitutionality of the impugned provision as to death penalty in Section 302, IPC on the ground of reasonableness in the light of articles 19 and 21 of the Constitution,, it is not necessary to express any categorical opinion, one way or the other, as to which of these two antithetical views, held by the Abolitionists and Receptionists, is correct."
d5_s81,"It is sufficient to say that the very fact that persons of reason, learning and light are rationally and deeply divided in their opinion, on this issue, is a ground among others, for rejecting the petitioners' argument that retention of death penalty in the impugned provision is totally devoid of reason and purpose."
d5_s82,"If, notwithstanding the view of Abolitionists to the contrary, a very large segment of people, the world over, including sociologists, legislators, jurists, judges and administrators still firmly believe in the worth and necessity of capital punishment for the protection of society, if in the perspective of prevailing crime conditions in India, contemporary public opinion channelized through the people's representatives in Parliament, has repeatedly in the last three decades, rejected all attempts, including the one made recently, to abolish or specifically restrict the area of death penalty, if death penalty is still a recognised legal sanction for murder or some types of murder in most of the civilised countries in the world, if the framers of the Indian Constitution were fully aware . of the existence of death penalty as punishment for murder, under the Indian Penal Code, if Thirty fifth Report and subsequent reports of the Law Commission suggesting retention of death penalty, and recommending revision of the Criminal Procedure Code and the insertion of the new sections 235(2) and 354(3) in that Code providing for pre sentence hearing and sentencing procedure on conviction for murder and other capital offences were before the Parliament and presumably considered by it when in 1972 73 it look up revision of the Code of 1898 and replaced it by the Code of Criminal Procedure, 1973, it is not possible to hold that the provision of death penalty as an alternative punishment for murder, in section 302, Penal Code is unreasonable and not in the public interest"
d5_s83,"We would, therefore, conclude that the impugned provision in section 302, violates neither the letter nor the ethos of Article 19."""
d5_s84,"In that decision, Bhagwati, J. (as the learned Chief Justice then was), dissented."
d5_s85,He held that death sentence was bad morally as well as Constitutionally.
d5_s86,It is no longer necessary in view of the majority judgment to deal with these views in detail.
d5_s87,This aspect was examined in several cases and a bench of five learned Judges considered this question again in Smt.
d5_s88,"Triveniben vs State of Gujarat, [1989] 1 SCC 678 1989 Indlaw SC 43, where Oza, J. speaking for the majority analysed the trend and observed at p. 688 that it was not necessary to go into the jurisprudential theories of punishment deterrent or retributive in view of what has been laid down in Bachan Singh's case (supra) with which learned Judges therein agreed."
d5_s89,"It is well settled now that undue long delay in execution of the sentence of death would entitle the condemned person to approach this Court or to be approached article 32 of the Constitution, but this Court would only examine the nature of delay caused and circumstances that ensued after sentence was finally confirmed by the judicial process and will have no jurisdiction to reopen the conclusions reached by the Court while finally maintaining the sentence of death."
d5_s90,But the court is entitled and indeed obliged to consider the question of inordinate delay in the light of all circumstances of the case to decide whether the execution of sentence should be carried out or should be altered into imprisonment for life.
d5_s91,No fixed period of delay can be considered to be decisive.
d5_s92,It has been emphasised that article 21 is relevant in all stages.
d5_s93,"Speedy trial in criminal cases though may not be fundamental right, is implicit in the broad sweep and content of Article 21."
d5_s94,Speedy trial is part of one's fundamental right to life and liberty.
d5_s95,This principle is no less important for disposal of mercy petition.
d5_s96,It has been universally recognised that a condemned person has to suffer a degree of mental torture even though there is no physical mistreatment and no primitive torture.
d5_s97,"See the 'observations of Shetty, J. in Triveniben's case (supra) at p. 7 13 7 14 of the report, where it has been observed that as between funeral fire and mental worry, it is the latter which is more devastating, for funeral fire burns only the dead body while the mental worry burns the living one."
d5_s98,"In the instant case, Gyasi Ram has suffered a great deal of mental agony for over eight years."
d5_s99,It is not disputed that there has been long delay.
d5_s100,We do not find reasons sufficiently commensurate to justify such long delay.
d5_s101,"The convict has suffered mental agony of living under the shadow of death for long, far too long."
d5_s102,He should not suffer that agony any longer.
d5_s103,"In the aforesaid facts and the circumstances of the case, therefore, we direct that the death sentence should not be carried out and the sentence imposed upon him be altered to imprisonment for life."
d5_s104,We order accordingly.
d5_s105,This W.P. is disposed of with the aforesaid direction.
d6_s1,"Tenant inducted in 1979, for three years, 2by the landlord under a written agreement, in C 4/33, Safdarjang Development Area, New Delhi, with permission of Controller under Section 21 of Delhi Rent Control Act (for brevity 'the Act') seeks leave of this Court on limited question of law if proceedings for recovery of possession under Section 21 of the Act could be initiated and continued by legal representatives of the landlord who had obtained permission but who died before expiry of period of tenancy."
d6_s2,"Answer of it shall depend, primarily, on construction of word 'landlord' used in Section 21, a provision held to be self contained code in Shiv Chand Kapoor vs Amar Bose, [1990] 1 SCC 234 1989 Indlaw SC 332 and also the purpose and objective of its enactment as provision of short duration tenancy or periodical tenancy in Rent Control Act of Delhi right from 1952, is unique amongst such legislations and is probably non existent in any other State."
d6_s3,It reads as under:
d6_s4,Recovery of possession in case of tenancies for limited period:
d6_s5,"(1) Where a landlord does not require the whole or any part of any premises for a particular period, and the landlord, after obtaining the permission of the Controller in the prescribed manner, lets the whole of the premises or part thereof as a residence for such period as may be agreed to in writing between the landlord and the tenant and the tenant does not, on the expiry of the said period, vacate such premises, then, notwithstanding anything contained in Section 14 or in any other law, the Controller may, or an application made to him in this behalf by the landlord within such time as may be prescribed, place the landlord in vacant possession of the premises or part thereof by evicting the tenant and every other person who may be in occupation of such premises."
d6_s6,"(2) while making an order under sub section (1), the Controller may award to the landlord such damages for the use or occupation of the premises at such rates as he considers proper in the circumstances of the case for the period from the date of such order till the date of actual vacation by the tenant."""
d6_s7,"What it, undoubtedly, projects is the legislative awareness of acute crisis of houses in the State."
d6_s8,"To resolve the paucity of accommodation, on one hand, due to enormous influx of office personnel and business class as a result of rapid growth of social, economic and political activity and apprehension of house owners, on other, bulk of whom hail from middle class or service class, of loosing their houses if not for good then for substantial period due to development of strange phenomenon in big cities that allotted or rented houses are more economical than, even, own the legislature which is the best judge of need of its people carved out an exception to usual rent control provisions of protecting tenants from eviction What was unique of it was not short duration tenancy but a fresh look on eviction."
d6_s9,"Vacant possession was ensured, statutorily, without any notice, or termination of tenancy or the hazard of establishing bona fide need and comparative hardship etc."
d6_s10,"Since sec. 21 is an exception to Section 14 and it mandates restoration of possession, ""notwithstanding any other law"" it has to be construed strictly and against any attempt to frustrate it."
d6_s11,"Intensity of it can be appreciated better if its language, is compared with other provisions of recovery of possession even though those provisions, namely, secs. 14A, 14B, 14C and 14D, were introduced later."
d6_s12,They also provide speedy remedy to recover possession.
d6_s13,But the landlord cannot succeed unless he is able to prove circumstances mentioned in it.
d6_s14,More than this the tenant has been given right to contest under Section 25B. Import of Section 21 on the other hand is altogether different.
d6_s15,"It enjoins Controller to place landlord in vacant possession after expiry of time without any right to tenant to contest it except to the limited extent that permission was vitiated by fraud as held in S.B. Noronah vs Prem Kumari Khanna, [1980] 1 SCC 52 1979 Indlaw SC 198 or misuse of the provision by land lord taking advantage of helpless situation of the tenant as held in V.S. Rahe vs Smt."
d6_s16,"Rem Chambeh, [1984] 1 SCC 612 1984 Indlaw SC 119; or the permission really did not create genuine tenancy as held in Shiv Chand Kapoor vs Amar Bose 1989 Indlaw SC 332, supra."
d6_s17,"Recovery of possession under Section 21 is not hedged, by any inquiry or opportunity, if permission is not challenged on any of those exceptions which have been carved out by courts, obviously, to uphold fairness and honesty the core of our jurisprudence."
d6_s18,"Right to get vacant possession is, thus absolute."
d6_s19,"Purpose and objective of the Section having been ascer tained, it may now be examined if the word ""landlord"" used in the second part of the Section which empowers landlord to make an application for recovery of possession is to be understood as the same landlord who made the application or his legal representatives as well."
d6_s20,"In other words, is there any justification for construing the word ""landlord"" in a narrow sense so as to restrict it, only, to the person who made the application and obtained permission. ""Landlord"" has been defined in Section 2(e) as under:"
d6_s21,"(e). 'landlord' means a person who, for the time being is receiving, or is entitled to receive, the rent of any premises, whether on his own account or on account of or on behalf of, or for the benefit of, any other person or who would so receive the rent or be entitled to receive the rent, if the premises were let to a tenant."" Expression, ""for the time being"" makes it clear, that land lord has to be understood in praesentii."
d6_s22,That is anyone entitled to receive rent is the landlord.
d6_s23,"It does not visualise, past or future landlord."
d6_s24,"Therefore, the word ""land lord"". on plain reading of Section 21 does not warrant construction of the word in any other manner."
d6_s25,"Basis for submission, however, that landlord in second part of Section 21 entitling him to claim vacant possession should be confined to the person who obtained permission was rounded on use of expression, ""who does not require the whole or any part of the premises for a particular period."" Attempt was made to personalise eviction proceedings by linking it with the person, due to whose non requirement the permission was granted resulting in automatic exclusion of legal representatives."
d6_s26,"To put it interpretationally the word ""landlord"", in second part was urged to be understood in a manner different than it is defined in Section 2(e)."
d6_s27,"Can it be said that context or setting of Section 21 is such that the word ""landlord"" in second part of it should be understood in a different sense than that in definition clause? Not on prima facie reading of it which has already been adverted to."
d6_s28,Neither on close analysis.
d6_s29,"What is visualised is occasion for short duration tenancy due to non requirement of whole or part of premises by landlord for time being; method of its creation by written agreement entered with tenant, statutory status to it by permission obtained from Controller and execution by restoration of vacant possession if the tenant does not vacate after expiry of period."
d6_s30,All condensed in one.
d6_s31,Constructionally it is in two parts one creation of short term tenancy and other its execution after expiry of time.
d6_s32,Both stand on their own and operate independently.
d6_s33,Non requirement of premises for time being furnishes basis for entering into agreement for periodical tenancy.
d6_s34,Truth of it on its genuineness are relevant considerations for granting permission.
d6_s35,But it exhausts thereafter except to the limited extent pointed out in decisions referred earlier.
d6_s36,"And the permission granted continues unabated, unaffected irrespective of variation in requirement."
d6_s37,"Necessity of landlord, again, does not entitle him to seek its revocation."
d6_s38,Even his death cannot shorten the period.
d6_s39,"Similarly once period expires the agreement, the permission all cease to operate by operation of law."
d6_s40,Nothing further is required.
d6_s41,Vacation is not linked with landlord but with time.
d6_s42,Expiry of it obliges tenant to vacate.
d6_s43,If he does not then the landlord may approach Controller for putting him in vacant possession.
d6_s44,Which land lord? Obviously whosoever is the landlord at the time of afflux of tenancy.
d6_s45,Death of landlord does not either shorten or enlarge period nor the consequences envisaged are altered or affected.
d6_s46,Use of expression notwithstanding any other law render it obligatory on tenant to vacate without questioning authority of landlord.
d6_s47,"Any other construction, may, as rightly observed by the High Court lead to disastrous consequences."
d6_s48,Even on principles of civil law the provision for recovery of possession being in nature of execution it could not be successfully resisted on the death of landlord due to whose non requirement the permission was granted.
d6_s49,Such narrow and unreaIistic construction of the word 'landlord' shall frustrate entire purpose of Section 21.
d6_s50,"Maxim of action personalies mortiur cum personna cannot apply, either, on principle or on facts."
d6_s51,In Supreme Bank v.
d6_s52,"P.A. Tendulkar, AIR 1973 SC 1104 1973 Indlaw SC 337 this Court while discussing applicability of the maxim held ""whatever view one may take of the justice of the principle it was clear that it would not be applicable to actions based on contract or where tort feasers' Estate had benefitted from a wrong done."
d6_s53,"Its applicability was generally confined to actions for damages for defamation, seduction inducing a spouse to remain apart from the other and adultery."" In Phool Rani vs Naubat Rai, [1973] 3 SCR 769 1973 Indlaw SC 350; a decision which was relied by petitioner in support of submission that an application filed for eviction of a tenant on bona fide need lapses on the death of landlord and it could not be continued by his legal representatives overruled in Shanti Lal Thakur Das and Ors. vs Chaman Lal Maganlal Telwala, [1977] 1 SCR 313 it was observed that doctrine of actio personalis moritur cum personna, did not apply to Rent Control Acts."
d6_s54,Even otherwise an action for eviction abates only if the cause of action does not survive.
d6_s55,What is the cause of action for an application for vacant possession in Section 21 death of landlord or expiry of time for which tenancy was created.
d6_s56,"Obviously the latter, the failure' of tenant to honour his commitment to vacate the premises after expiry of time for which he was inducted with permission of Controller."
d6_s57,The death of the person who obtained the permission has nothing to do with it.
d6_s58,Permission was obtained because the landlord did not require the premises on the date when it was let out to tenant.
d6_s59,That does not continue on the date when the tenant does not vacate the premises.
d6_s60,"The necessity of not requiring the premises, for some time, or for the duration the tenant was inducted was confined to the date when the permission was granted."
d6_s61,It could not be taken further to the time when the question of vacation arose.
d6_s62,The cause of action for granting permission was the non requirement by the landlord of the premises for the time mentioned in the agreement whereas cause of action for eviction is non vacation by the tenant after the expiry of period.
d6_s63,"Therefore, it is immaterial who is the landlord at the time when the Action for vacation arose."
d6_s64,"Even on facts permission was applied for by the landlord as, premises was surplus to his need for a limited period of 3 years due to the reason that his son had gone abroad and he was expected to return after three years."
d6_s65,Permission was granted for this reason on statement of parties.
d6_s66,Such necessity to let out or non requirement by the landlord could not be brought into those exceptions which invalidate permission.
d6_s67,Therefore death of the landlord was immaterial as even the reason for letting out did not die with death of landlord.
d6_s68,In the result this petition for special leave fails and is dismissed.
d6_s69,"In the circumstances of the case the tenant is directed to suffer costs which we quantify at Rs.5,000."
d6_s70,Petition dismissed
d7_s1,"This writ petition under Article 32 of the Constitution of India is by the mother of the detenu Noor alias Babu to quash the detention order F. no. 801/1/90 PITNDPS dated 25.1.1990 passed under Section 3 of the Prevention of Illicit Traffic in Narcotic Drugs and Psychotropic Substances Act, 1988 (in short 'PIT'NDPS Act') and the order of confirmation F. no. 801/1/90 PITNDPS dated 24.4.1990 'passed under Section 9(f) read with Section 10(2) of the 'PIT'NDPS Act, by the Central Government directing detention of the detenu for a period of two yeare w.e.f. 30.1.1990."
d7_s2,The only argument advanced in support of this writ petition is infraction of Article 22(5) of the Constitution of India.
d7_s3,The facts material for the point raised are stated hereafter.
d7_s4,"The detenu was arrested from his family estate at Kochuveetil House, Kuthugal, Udumpanchola Taluk, Idikki District, Kerala on 19.10.1989 on the accusation that he and his brothers were involved in extensive illicit cultivation of ganja plants (Cannabis Sativa) in violation of the provisions of Narcotic Drugs and Psychotropic Substances Act, 1985 (in short 'NDPS Act'), He was produced before the Judicial Magistrate who rejected his bail application."
d7_s5,"The Sessions Judge also rejected the bail application once but late, granted conditional bail."
d7_s6,"Thereafter, the detention order dated 25.1.1990 was served on the detenu on 30.1.1990."
d7_s7,"It was stated therein that even though prosecution of the detenu was likely to be initiated under the NDPS Act, there was likelihood of the detenu indulging in cultivation and production of narcotic drugs (ganja) on the detenu being released on bail on account of which there was compelling necessity to detain him under the PITNDPS Act."
d7_s8,"The detenu was informed that he had a right to make representation to the detaining authority, Central Government and the Central Advisory Board against the detention order."
d7_s9,The mode of address of the representation to the Central Government and the Central Advisory Board was also indicated in the detention order along with the grounds of detention in accordance with Article 22(5) of the Constitution of India.
d7_s10,The detenu's case was referred by the Central Government to the Central Advisory Board on 2.3.1990.
d7_s11,"During pendency of the reference before the Advisory Board, the detenu made his representation on 24.3.1990 and addressed it to the Advisory Board."
d7_s12,The Advisory Board considered the reference relating to the detenu made by the Central Government and also the detenu's representation submitted to it.
d7_s13,"The Advisory Board, gave the opinion that there was sufficient cause to justify his preventive detention."
d7_s14,The Central Government then made the order dated 24.4.1990 confirming his detention and directed that the detenu Noor alias Babu be detained for a period of two years w.e.f. 30.1.1990.
d7_s15,It is admitted that the Advisory Board considered the detenu's representation before sending its opinion to the Central Government along with the entire record including the representation submitted by the detenu.
d7_s16,"It is also admitted that the Central Government made the order of confirmation dated 24.4.1990 on receipt of the opinion of the Advisory Board, but there was no independent consideration of the detenu's representation by the Central Government at any time."
d7_s17,"In the counter affidavit filed initially by Shri A.K. Roy, Under Secretary to the Government of India, this fact was not clearly stated and, therefore, we directed an additional affidavit to be filed."
d7_s18,"In the additional affidavit filed by Shri A.K. Roy, it has not been disputed that the Central Government did not at any time consider independently the detenu's representation addressed to and given to the Advisory Board."
d7_s19,"In the additional affidavit, the stand of the Central Government in this behalf has been stated thus:""."
d7_s20,"Since the detenu in the present case has not made any representation to the Central Government, the assertion in para 2 of the grounds of petition that no opportunity was afforded by the Central Government to the said detenu is vehemently denied."
d7_s21,"The question of consideration of a representation and providing of an opportunity would only arise when a representation is duly made to the Central Government."""
