id,text
d1_s1,The Order of the Court was as follows:
d1_s2,"We have heard learned counsel for the petitioner as well as counsel for the, State of West Bengal."
d1_s3,"In our opinion, the detention of the, detenu suffers from great infirmity as pointed out by this Court in Sk."
d1_s4,"Abdul karim and others vs The State of West Bengal 1969 Indlaw SC 262 (Writ Petition no. 327 of 1968 decided on January 31, 1969)."
d1_s5,The petitioner is ordered to be released forthwith.
d1_s6,We shall give our reasons for the release later.
d1_s7,"Ray, J."
d1_s8,The petitioner made an application article 32 of the Constitution requiring the respondent to show cause as to why the petitioner should not be released.
d1_s9,"At the conclusion of the hearing of this petition on 15 October, 1969 we directed the release of the petitioner and stated that the reasons would be given later on."
d1_s10,"We are stating our reasons for the order. 'On 5 June, 1969 the District Magistrate, 24 Parganas, West Bengal made an order section 3(2) of the Preventive Detention Act, 1950 (hereinafter called the Act) for the detention of the petitioner."
d1_s11,"On 7 June, 1969 the petitioner was arrested and on the same day grounds of detention were served on the petitioner."
d1_s12,"On 9 June, 1969 information was given to the State Government."
d1_s13,"On 14 June, 1969 the Governor was pleased to approve the order of detention and on the same day the Governor sent the report to the Central Government section 3(4) of the Act together with the grounds of detention."
d1_s14,"On 23 June, 1969 the petitioner made a representation to the State Government."
d1_s15,"On 1 July, 1969 the State Government placed the case of the petitioner before the Advisory Board section 9 of the Act together with the said representation."
d1_s16,"On 13 August, 1969, the Advisory Board after consideration of the materials placed before it was of the opinion that there was sufficient cause for the detention of the petitioner."
d1_s17,"On 19 August, 1969 the State Government is alleged to have rejected the petitioner's representation."
d1_s18,"By an order dated 26 August, 1969 the Governor was pleased to confirm the order of detention of the petitioner."
d1_s19,"The only contention on behalf of the petitioner was that though the petitioner made the representation on 23 June, 1969 the Government did not consider the said representation with reasonable and proper expedition."
d1_s20,"On behalf of the State of West Bengal it was contended first that the matter was referred to the Advisory Board along with the petitioner's representation and the State Government considered the report of the Advisory Board, and, secondly, the affidavit of Rathindra Nath Sen Gupta affirmed on 19 September, 1969 will show that enquiries were made after the petitioner had made the representation and the Government therefore considered the representation."
d1_s21,The affidavit of Rathindra Nath.
d1_s22,Sen Gupta is of little value.
d1_s23,"The deponent stated first that he caused further enquiries to be made through the Superintendent, I Railway Police after he had received the representation of the petitioner from the State Government, secondly, that the Superintendent."
d1_s24,"Railway Police took a little time to submit a report, thirdly, the deponent after being satisfied about anti social activities of the petitioner informed the State Government on 12 August, 1969 to the effect that he did not recommend the release of the petitioner, and, fourthly, that the State Government on 19 August, 1969 rejected the petitioner's representation."
d1_s25,"There is no affidavit by the Superintendent of Po1ice, Sealdah who is alleged to have made further enquiries."
d1_s26,"One will look in vain into the affidavit of the deponent to find out as to when the deponent entrusted the said enquiry to the Superintendent, Railway Police and further as to what time was taken for enquiry and report."
d1_s27,The Court is entitled to know the time and the steps taken along with the nature of the enquiry.
d1_s28,The importance of the matter lies in the fact that it is a case of preventive detention and the personal liberty of a citizen is under consideration of the State Government.
d1_s29,The State.
d1_s30,"Government is, therefore, bound to give the utmost information to this Court."
d1_s31,The Preventive Detention Act confers powers on the Central Government or the State Government to make an order for detention of a person.
d1_s32,The order of detention can be passed by the District Magistrate or the Additional District Magistrate or the Commissioner of Police or the Collector.
d1_s33,When an order is made by any 'of these officers he shall forthwith report the fact to the State Government to which he is subordinate together with the grounds and no such order shall remain in force for more than 12 days after the making of the order unless it is approved by the State Government.
d1_s34,"The State Government shall, as soon as may be, report the fact to the Central Government."
d1_s35,U/s. 7 of the Act grounds of order of detention are to be disclosed to the persons affected by the order not later than 5 days from the date of detention and the Act further requires to afford the person affected by the order the earliest opportunity of making a representation against the order to the appropriate Government.
d1_s36,"In the present petition, we are concerned with the scope and intent of section 7 of the Act in regard to the representation made by the petitioner. section 8 of the Act contemplates constitution of Advisory Boards. section 9 requires the appropriate Government within 30 days from the date of detention to place the grounds and the representation, if any, before the Advisory Board."
d1_s37,"The Advisory Board section 10 is to consider the materials and if the Board considers it essential to hear the person concerned who desires to be heard, the Board will hear the person and make the report."
d1_s38,Section II of the Act states that the Government may confirm the detention order if the Advisory Board gives an opinion to that effect.
d1_s39,U/s. 13 of the Act the State Government may revoke an order passed by its officers and the Central Government may revoke an order made by the State Government.
d1_s40,"Counsel on behalf of the State of West Bengal contended that the matter was referred to the Advisory Board along with the representation of the detenu dated 23 June, 1969 and the State Government on 19 August, 1969 rejected the representation of the petitioner and thus discharged its duty."
d1_s41,This contention has to be examined in the light of article 22 of the Constitution and the provisions of the Act.
d1_s42,There have been five recent decisions of this Court on the provisions of this Act particularly in regard to the right of the detenu to have his representation considered by the appropriate Government and the obligation of the appropriate Government in that behalf.
d1_s43,In Sk.
d1_s44,"Abdul Karim & Ors. vs The State of West Bengal, (1969) 3 S.C R. 479 1969 Indlaw SC 262 this Court held that the appropriate Government could not be said to discharge the obligation merely by forwarding the representation of the detenu to the Advisory Board. article 22 of the Constitution guarantees the right of a detenu to have a proper consideration of the representation by the appropriate authority."
d1_s45,"In the case of Pankaj Kumar Chakravarty & Ors. vs The State of West Bengal, [1970] 1 S.C.R.543 1969 Indlaw SC 128 this Court put in the forefront the distinction between the twin obligations of the appropriate authority sections 7 and 8 of the Act."
d1_s46,The appropriate Government is to consider the representation of the detenu inasmuch as section 7 of the Act speaks of affording the detenu the earliest opportunity of making a representation against the order of detention.
d1_s47,The obligation of the appropriate authority to consider the representation of the detenu under section 7 of the Act is entirely independent of any action of the Advisory Board or any consideration by the said Board of the representation of the detenu.
d1_s48,"In the case of Pankaj Kumar Chakrabarty, [1970] 1 S.C.R.543 1969 Indlaw SC 128 this Court observed :"
d1_s49,The peremptory language in cl. 5 of article 22 of the Constitution and section 7 of the Act would not have been necessary if the Board and not the Government had to consider the representation.
d1_s50,There is another reason why the appropriate Government is required to consider on its own the representation of the detenu.
d1_s51,If the consideration of the representation of the detenu by the Board sufficed the Constitutional guarantee section 7 of the Act would be robbed of its content.
d1_s52,"In Pankai Kumar Chakrabarty's case, [1970] 1 S.C.R.543 1969 Indlaw SC 128 this Court emphasised the aspect that the representation was addressed to the Government and not directly to the Advisory Board and it was for the reason that the appropriate authority was to exercise its opinion and judgment in an independent and honest manner."
d1_s53,"It, therefore, follows that the appropriate authority is to consider the representation of the detenu uninfluenced by any opinion or consideration of the Advisory Board."
d1_s54,"In the case of Khairul Haque vs State of West Benga, W.P. no. 246 of 1969 decided on 10 9 1969. this Court observed that ""it is' implicit in the language of article 22 that the appropriate Government, while discharging its duty to consider the representation cannot depend upon the views of the Board on such representation""."
d1_s55,The logic behind this proposition is that the Government should immediately consider the representation of the detenu before sending the matter to the Advisory Board and further that such action will then have the real flavour of independent judgment.
d1_s56,"In the case of Shyamal Chakraborty vs The Commissioner of Police, Calcutta & Anr., [1970] 1 S.C.R. 762 1969 Indlaw SC 132 one of the contentions was that the detenu's representation was not considered by the Government."
d1_s57,"There, the facts were these."
d1_s58,"The detenu was arrested on 13 November, 1968."
d1_s59,"On 6 January, 1969 the Governor was pleased to confirm the order of detention after the Advisory Board had given opinion that there was sufficient cause for detention of the petitioner."
d1_s60,"The detenu thereafter on 13 or 16 January, 1969 made a representation."
d1_s61,"On I April, 1969 the Commissioner of Police informed the Home Department that he did not recommend the release of the petitioner."
d1_s62,"On 28 March, 1969 notice was issued under Article. 32 of the Constitution to the Commissioner of Police and to the State Government to show cause why the petitioner should not be set at liberty."
d1_s63,"It is curious that even when Shayamal's case, [1970] 1 S.C.R. 762 1969 Indlaw SC 132 was heard in this Court on 4 August 1969 the representation of the petitioner could not be traced."
d1_s64,"This, Court did not accept the contention of the petitioner that there was any breach of section 7 of the Act on consideration of the facts that the detenu did not choose to make a representation till after the Advisory Board had dealt with the matter and further that the State Government was in the process of dealing with the representation and the detenu did not state that the grounds of detention were false."
d1_s65,"This Court concluded in the case of Shyamal Chakraborty, [1970] 1 S.C.R. 762 1969 Indlaw SC 132 by stating that the State Government would deal with the representation and pass a suitable order."
d1_s66,"When the present Writ Petition came up for hearing on 30 September, 1969 before the Bench consisting of Sikri, Mitter and Reddy, JJ., the matter was referred for decision by a larger Bench to consider as to what would be the question of period within which the Government could dispose of the representation of the detenu because it was felt that there was an apparent conflict between the cases , of Shyamal Chakraborty, [1970] 1 S.C.R. 762 1969 Indlaw SC 132and Khairul Haque, W.Ps. Nos. 246 f 1969 decided on 10 9 1969."
d1_s67,"In view of the fact that there is a fundamental right of the detenu to have the representation considered by the, appropriate Government such right will be rendered meaningless if the Government will not deal with the matter expeditiously but at its own will and convenience."
d1_s68,"In the case of Khairul Haque W.Ps. Nos. 246 f 1969 decided on 10 9 1969 the petitioner made a representation on 23 June, 1969."
d1_s69,"The Advisory Board made its report on 11 August, 1969."
d1_s70,"On 12 August, 1969, the Governor confirmed the order of detention."
d1_s71,"On 29 August, 1969 the Governor rejected the petitioner's representation."
d1_s72,The delay was not explained in the case.
d1_s73,The disposal of the representation by the Government after the receipt of the Report of the Advisory Board was found by this Court to raise a doubt there whether the Government considered the representation in an independent manner.
d1_s74,This independent consideration by the appropriate Government is implicit in article 22 of the Constitution.
d1_s75,"In the case of Durga Show and Ors., W.Ps. Nos. 198, 205 and 206 of 1969 decided on 2 9 1969. three petitioners were set at liberty."
d1_s76,"There the representation of one detenu was received on 29 May, 1969, and was rejected on II' August, 1969."
d1_s77,"In another case the representation of the detenu was receiver on 18 June. 1969 and was rejected by the Government on 16 August, 1969."
d1_s78,"In the third case the representation of the detenu was received on 28 June, 1969 and was rejected on 14 July, 1969."
d1_s79,"In the case of Durga Show and Ors., W.Ps. Nos. 198, 205 and 206 of 1969 decided on 2 9 1969 the opinion of this Court in the case of Sk."
d1_s80,"Abdul karim, (1969] 3 section C. R. 479 1969 Indlaw SC 262 was restated by emphasising the legal obligation of the appropriate Government to consider the representation of the detenu ""as soon as it is received by it""."
d1_s81,It is established beyond any measure of doubt that the appropriate authority is bound to consider the representation of the detenu as early as possible.
d1_s82,The appropriate Government itself is bound to consider the representation as expeditiously as possible.
d1_s83,The reason for immediate consideration of the representation is too obvious to be stressed.
d1_s84,The personal liberty of a person is at stake.
d1_s85,"Any, delay would not only be an irresponsible act on the part of the appropriate authority but also unconstitutional because the Constitution enshrines the fundamental right of a detenu to have his representation considered and it is imperative that when the liberty of a person is in peril immediate action should be taken by the relevant authorities."
d1_s86,"No definite time can be laid down within which a representation of a detenu should be dealt with save and except that it is a constitutional right of a detenu to, have his representation considered as expeditiously as possible."
d1_s87,"It will depend upon the facts and circumstances of each case whether the appropriate Government has disposed of the case as expeditiously as possible for otherwise in words of Shelat, J. who spoke for this Court in the case of Khairul Haque, W.P. no. 246 of 1969 decided on 10 9 1969."
d1_s88,"it is obvious that the obligation to furnish the earliest opportunity to make a representation loses both its purpose and meaning."
d1_s89,"Broadly stated, four principles are to be followed in regard to representation of detenus."
d1_s90,"First, the appropriate authority is bound to give an opportunity to the detenu to make a representation and to consider the representation of the detenu as early as possible."
d1_s91,"Secondly, the consideration of the representation of the detenu by the appropriate authority is entirely independent of any action by the Advisory Board including the consideration of the representation of the detenu by the Advisory Board."
d1_s92,"Thirdly, there should not be any delay in the matter of consideration."
d1_s93,It in true that no hard and fast rule can be laid down as to the measure of time taken by the appropriate authority for consideration but it has to be remembered that the Government has to be vigilant in the governance of the citizens.
d1_s94,A citizen's right raises a correlative duty of the State.
d1_s95,"Fourthly, 'the appropriate Government is to exercise its opinion and judgment on the representation before sending the case along with the detenu's representation to the Advisory Board."
d1_s96,If the appropriate Government will release the detenu the Government will not send the matter to the Advisory Board.
d1_s97,If however the Government will not release the detenu the Government will send the case along with the detenu'S representation to the Advisory Board.
d1_s98,If thereafter the Advisory Board will express an opinion in favour of release of the detenu the Government will release the detenu.
d1_s99,If the Advisory Board will express any opinion against the release of the detenu the Government may still exercise the power to release the detenu.
d1_s100,"In the present case, the State of West Bengal is guilty of infraction of the Constitutional provision not only by inordinate delay of the consideration of the representation but also by putting off the consideration till after the receipt of the opinion of the Advisory Board."
d1_s101,As we have already observed there is no explanation for this inordinate delay.
d1_s102,The Superintendent who made the enquiry did not affirm an affidavit.
d1_s103,The State has given no information as to why this long delay occurred.
d1_s104,"The inescapable conclusion in the present case is that the appropriate authority failed to discharge its constitutional, obligation by inactivity and lack of independent judgment."
d1_s105,"The petition is, therefore, allowed."
d1_s106,The petitioner is set at liberty.
d1_s107,Petition allowed.
d2_s1,Civil Appeals Nos. 2000 2001 of 1969 from the judgment and order of the Kerala High Court are by grant of special leave by this Court filed on the ground that these appeals raise a question of wide general importance.
d2_s2,"This question was thus framed, in a reference made by the Madras Bench of the Income tax Appellate Tribunal section 64(1) of the Estate Duty Act, 1953:"
d2_s3,"Whether on the facts and in the circumstances of the case, the Appellate Tribunal was correct in law in having included the value of the forest lands in the total value of the Estate for the purpose of Estate Duty ?"
d2_s4,"The assessee had claimed that large tracts of, forest land, covered with wild and natural forest growths, situated in the erstwhile Malabar District, were 'agricultural' lands not liable to estate duty under the Estate Duty Act of 1953 (hereinafter referred to as the Act')."
d2_s5,"According to the Revenue, duty had become leviable on the death of the former owners, Smt."
d2_s6,"Jayalakshmi Devi, who died on 6 3 1954, and Shri Madhava Rajah of Kollengode, who died on 9th May, 1955, each owning 1/13th share in the Tarwad properties on the dates of their deaths."
d2_s7,No question as to the effect of any amendment of the law upon liability of agricultural laud to Estate duty was referred by the Tribunal to the High Court.
d2_s8,"Nevertheless, it seems to have been considered by reason of the general nature of the question referred involving a determination of the correctness of the inclusion of the value of ""forest land in the total value of the estate""."
d2_s9,"We may observe here that the question framed seems to rest on the assumption that the land under consideration was ""forest land""."
d2_s10,"However, the general nature of the question framed and the questions argued and decided by the Appellate Tribunal as well as the High Court indicated that the real contest was about the very nature of the land involved in order to determine whether it was liable to estate duty."
d2_s11,"The High Court had observed that the Tribunal's findings that land, to the extent of 36,857.16 acres, was not agricultural land was ""solely based on the absence of evidence or the assessee's failure to prove that the disputed forest lands are agricultural lands""."
d2_s12,The High Court had also mentioned the basis of this finding relating to two types of land about which it had disagreed with the Appellate Tribunal while agreeing with the Tribunal that 500 acres of rocky land was non agricultural land.
d2_s13,This basis was given by quoting the 'following two passages from the judgment of the Appellate Tribunal:
d2_s14,"(1) According to the valuers, the remaining extent of 15,000 and odd acres out of the first category, has been leased by the assessee from time to time for cutting of timber and fuel wood, and has never been used by him either by himself or through lessees to bring it under cultivation for any purpose."
d2_s15,There is no material on record from which it can be said that this area can at all be brought under cultivation for any purpose.
d2_s16,"Even if it is assumed that, there is a bare possibility of this area being brought under cultivation, the assessee has not placed any material before us from which it can be said that a prudent owner would undertake any process of farming in respect of this land""."
d2_s17,"(2) ""With regard to the second category of the land of the extent of 16,000 and odd acres, the report of the valuers does not throw any light upon the nature of this land, and the only information available is that these lands have been held by the Kerala Government under a perpetual lease on an annual rent of rs. 5,000/ ."
d2_s18,The assessee has not shown whether this land was being cultivated. by the Kerala Government or whether it was Only being exploited by the Kerala Government for its timber value.
d2_s19,"On the material on record, it is not possible for these lands to come. under the category of agricultural lands""."
d2_s20,The High Court had set out the provisions of section 5 of the Act as they stood before a slight amendment in 1956.
d2_s21,It read:
d2_s22,Levy of estate duty
d2_s23,"(1) In the case of every person dying after the commencement of this Act, there shall, save as hereinafter expressly provided, be levied and paid upon the principal value ascertained as hereinafter provided of all property settled or not settled, including agricultural land situate in the States specified in the First Schedule to this Act, which passes on the death of such person, a duty called 'estate duty' at the rates fixed in accordance with section 35."
d2_s24,"(2) The Central Government may, by notification in the official Gazette, and the names of any other States to the First Schedule in respect whereof resolutions have been passed by the Legislatures of those States adopting this Act u/cl. (1) of article 252 of the Constitution in respect of estate duty on agricultural lands situate in those States, and on the issue of any such notification the States so added shall be deemed to be States specified in the First Schedule within the meaning of sub section (1)""."
d2_s25,"After pointing out that agricultural land falls under item 48 of List II or the State List in the Seventh Schedule of the Constitution, the High Court held that estate duty on the land under consideration would become leviable provided it was agricultural land on the passing of resolutions by the legislature of the State of Madras as provided by section 5 (2) set out above."
d2_s26,"These resolutions having been passed on 2 4 1955, the State of Madras was added in the First Schedule to the Act with effect from 6th June, 1955."
d2_s27,"Hence, the High Court held that the estate duty was not leviable under the Act on agricultural land, before 6th June, 1955, in the Madras State to which the land under consideration had belonged at the time when it was said to have become subject to a levy of estate duty."
d2_s28,"Thus, the principal question which arose was: What is the meaning of ""agricultural land"" as that term is used in the Act ?"
d2_s29,"The High Court of Kerala, which had to deal with this reference decided the question on two grounds: firstly, that, according to the views expressed in Sarojni Devi vs Srikrishna, A.I.R. 1944 Mad. 401 and Megh Raj vs Allah Rakha, A.I.R. 1942 PC 27 and C.I.T. West Bengal, Calcutta, vs Raja Benoy Kumar Sahas Roy, [1957] 32 ITR 466 1957 Indlaw SC 165 the words ""agricultural land"" should be ""interpreted in their widest significance""; and, secondly, that although the burden rested upon an assesee to establish an exemption from liability to estate duty in respect of any part of his estate, yet, if he claimed immunity on the ground that the subject matter does not fall within the ambit of the taxing power of the legislature imposing the duty, the Revenue had to establish that the subject matter involved is taxable."
d2_s30,It then gave its opinion in the following terms:
d2_s31,"It is well known that the extensive areas of different varieties of plantation that we have got in this State were once forest lands, and it is also equally well known that year after year large areas of forest lands in this State are being cleared and converted into valuable plantations."
d2_s32,"In the absence of exceptional circumstances such as the land being entirely rocky or barren for other reasons, all forest lands in this State are agricultural lands in the sense that they can be prudently and profitably exploited for agricultural purposes."
d2_s33,"There is no case that the forest lands concerned in this case or any part thereof are unfit for agricultural exploitation""."
