text,label
"See M.P. Housing Board and Another v Manoj Shrivastava [(2006) 2 SCC 702 2006 Indlaw SC 259], State of M.P. and Others v Arjunlal Rajak [(2006) 2 SCC 711 2006 Indlaw SC 260] and M.P. State Agro Industries Development Corpn.",Ratio of the decision
Ltd and Another v S.C. Pandey [(2006) 2 SCC 716] 2006 Indlaw SC 263,Ratio of the decision
Our attention has been drawn to a recent decision of this Court in Jasbir Singh vs Punjab & Sind Bank and Others reported in [(2007) 1 SCC 566] 2006 Indlaw SC 889 by the learned counsel appearing on behalf of the respondent.,Ratio of the decision
We do not see as to how the said decision is applicable to the fact of the present case.,Ratio of the decision
"In Jasbir Singh 2006 Indlaw SC 889 (supra), the Order of termination was passed on the ground of misconduct.",Ratio of the decision
"The said question was also the subject matter of a suit, wherein the Civil Court had held that the appellant therein was not guilty of the misconduct.",Ratio of the decision
"In that context only, the question in regard to the relief granted by the Court was considered in the light of the relief which may be granted by the Industrial Court under Section 11A of the Industrial Disputes Act stating;",Ratio of the decision
"It was, however, urged that no back wages should be directed to be paid.	Ratio of the decision
Reliance in this behalf has been placed on U.P. State Brassware Corpn.	Ratio of the decision
Ltd. vs Uday Narain Pandey.	Ratio of the decision
In that case, this Court was dealing with a power of the Industrial Courts under Section 11 A of the Industrial Disputes Act.	Ratio of the decision
Therein, as the establishment was closed, the question of reinstatement of the workman did not arise.	Ratio of the decision
Still then, 25% back wages were directed to be paid as also the compensation payable in terms of Section 6 N of the U.P. Industrial Disputes Act.	Ratio of the decision
The judgments of both the civil court and the criminal court established that the appellant was treated very unfairly and unreasonably.	Ratio of the decision
For all intent and purport, a criminal case was foisted upon him.	Ratio of the decision
A confession, according to learned Chief Judicial Magistrate, was extracted from him by the bank officers in a very cruel manner.	Ratio of the decision
It is, therefore, not a case where back wages should be denied.	Ratio of the decision
The respondent Bank has tried to proceed against the appellant in both in civil proceedings as well as in criminal proceedings and at both the independent forums, it failed.",Ratio of the decision
"We may notice that recently in Muir Mills Unit of NTC (U.P.) Ltd. vs Swayam Prakash Srivastava and Another [(2007) 1 SCC 491 2006 Indlaw SC 891], a Bench of this Court opined :",Precedent
"With regard to the contention of the respondents that in the present fact scenario retrenchment is bad under law as conditions under Section 6 N, which talks about a reasonable notice to be served on an employee before his/her retrenchment, is not complied with; we are of the view that even under Section 6 N the proviso states that no such notice shall be necessary if the retrenchment is under an agreement which specifies a date for the termination of service.",Precedent
"In the present case on the perusal of the appointment letter it is clear that no such notice needs to be issued to Respondent no. 1.""",Ratio of the decision
The respondents had referred to many cases with regard to back wages to be paid to the retrenched workman.,Ratio of the decision
The learned counsel cited a string of decisions of this Court in support of this contention.,Ratio of the decision
"We are however not addressing this plea of the respondents as we have already observed that Respondent 1 is not a workman under the Industrial Disputes Act, 1947 and the U.P. ID Act, 1947 and also that the retrenchment was not illegal and therefore the question of back wages does not arise.",Ratio of the decision
"We may also notice that in Uttranchal Forest Development Corporation v M.C. Joshi [2007 (3) SCALE 545 2007 Indlaw SC 149], this Court held;",Precedent
"Although according to the learned counsel appearing on behalf of the appellant the Labour Court and the High Court committed an error in arriving at a finding that in terminating the services of the respondent, the provisions of Section 6N of the UP Industrial Disputes Act were contravened, we will proceed on the basis that the said finding is correct.	Precedent
The question, however, would be as to whether in a situation of this nature, relief of reinstatement in services should have been granted.	Precedent
It is now well settled by reason of a catena of decisions of this Court that, the relief of reinstatement with full back wages would not be granted automatically only because it would be lawful to do so.	Precedent
For the said purpose, several factors are required to be taken into consideration, one of them being as to whether such an appointment had been made in terms of the statutory rules.	Precedent
Delay in raising an industrial dispute is also a relevant fact.",Precedent
"In Haryana State Electronics Development Corporation v Mamni [AIR 2006 SC 2427 2006 Indlaw SC 190], this Court directed payment of compensation.",Ratio of the decision
Similar orders were passed in North Eastern Karnataka Rt.,Ratio of the decision
Corporation vs Ashappa [(2006) 5 SCC 137 2006 Indlaw SC 243] and U.P. State Road Transport Corporation vs Man Singh [(2006) 7 SCC 752 2006 Indlaw SC 516],Ratio of the decision
In Man Singh 2006 Indlaw SC 516 (supra) it was held:,Precedent
"The respondent admittedly raised a dispute in 1986, i.e. after a period of about 12 years, it may be true that in an appropriate case, as has been done by the Labour Court, delay in raising the dispute would have resulted in rejection of his claim for back wages for the period during which the workman remains absent as has been held by this Court in Gurmail Singh vs Principal, Govt.",Precedent
College of Education 1999 Indlaw SC 1598.,Ratio of the decision
"But the discretionary relief, in our opinion, must be granted upon taking into consideration all attending circumstances.",Ratio of the decision
"The appellant is a statutory corporation Keeping in view the fact that the respondent was appointed on a temporary basis, it was unlikely that he remained unemployed for such a long time.",Ratio of the decision
"In any event, it would be wholly unjust at this distance of time. i.e. after a period of more than 30 years, to direct reinstatement of the respondent in service.",Ratio of the decision
"Unfortunately, the Labour Court or the High Court did not consider these aspects of the matter.",Ratio of the decision
"Keeping in view the particular facts and circumstances of this case, we are of the opinion that instead and in place of the direction for reinstatement of the respondent together with back wages from 1986, interest of justice would be subserved if the appellant is directed to pay a sum of rs. 50,000 to him.",Ratio of the decision
"Similar orders, we may place on record, have been passed by this Court in State of Rajasthan vs Ghyan Chand, 2006 Indlaw SC 1610 State of MP vs Arjunlal Rajak 2006 Indlaw SC 260, Nagar Mahapalika (now Municipal Corporation) vs State of U.P., and Haryana State Electronics Development Corporation Ltd. vs Mamni 2006 Indlaw SC 190.""",Precedent
It was further held :,Precedent
"The legal position has since undergone a change in the light of a Constitution Bench decision of this Court in Secretary, State of Karnataka & Ors. vs Uma Devi (3) & Ors. [(2006) 4 SCC 1] 2006 Indlaw SC 125 wherein this Court held that 'State' within the meaning of article 12 of the Constitution of India is under a constitutional obligation to comply with the provisions contained in articles 14 and 16 of the Constitution of India.",Precedent
"In this case, the Industrial Court exercised its discretionary jurisdiction under Section 11A of the Industrial Disputes Act.",Ratio of the decision
"It merely directed the amount of compensation to which the respondent was entitled to, had the provisions of section 25 F been complied with should be sufficient to meet the ends of justice.",Ratio of the decision
"We are not suggesting that the High Court could not interfere with the said order, but the discretionary jurisdiction exercised by the Industrial Court, in our opinion, should have been taken into consideration for determination of the question as to what relief should be granted in the peculiar facts and circumstances of this case.",Ratio of the decision
Each case is required to be dealt with in the fact situation obtaining therein.,Ratio of the decision
"We, therefore, are of the opinion that keeping in view the peculiar facts and circumstances of this case and particularly in view of the fact that the High Court had directed re instatement with full back wages, we are of the opinion that interest of justice would be subserved if appellant herein be directed to pay a sum of rs. 75,000/ by way of compensation to the respondent.",Ratio of the decision
This appeal is allowed to the aforementioned extent.,Ruling by Present Court
"However, in the facts and circumstances of this case, there shall be no order as to costs.",Ruling by Present Court
Appeal allowed.,Ruling by Present Court
The present appeal has been filed against the order dated 10.01.2005 passed by the Intellectual Property Appellate Board (in short 'the Board') in Original Appeal no. 35/2004/TM/KOL whereby the Board allowed the appeal filed by the respondent herein while setting aside the order dated 31.03.2004 passed by the Assistant Registrar of Trade Marks.,Facts
Brief facts:,Facts
"(a) One Shri Lal Babu Priyadarshi the appellant herein, trading as M/s Om Perfumery, Bakerganj, Daldali Road, Patna made an application to the Registrar of Trade Marks to register a trade mark by name ""RAMAYAN"" with the device of crown in class 3 in respect of incense sticks (agarbattis, dhoops) and perfumeries etc.",Facts
"(b) One Shri Amritpal Singh the respondent herein, was a dealer for the sale of the products of the appellant herein and was also trading as M/s Badshah Industries, Chitkohra, Punjabi Colony, Patna.",Facts
"The respondent herein filed a Notice of Opposition to oppose the registration of aforesaid trade mark under Sections 9, 11(a), 11(b), 11(e), 12(1), 12(3) and 18(1) of the Trade and Merchandise Marks Act, 1958 [repealed by the Trade Marks Act, 1999 (47 of 1999) in short 'the Act'] claiming that the impugned mark, being the name of a religious book, cannot become the subject matter of monopoly for an individual.",Facts
"(c) The Assistant Registrar of Trade Marks, after holding that the impugned trade mark consists of device of crown and the word ""RAMAYAN"" is capable of distinguishing the goods and is not included in the list of marks not registrable under the Act, by order dated 31.03.2004, dismissed the application filed by the respondent herein.",Facts
"(d) Being aggrieved by the order dated 31.03.2004, the respondent herein preferred an appeal before the Board being Original Appeal no. 35/2004/TM/KOL.",Facts
"The Board, by order dated 10.01.2005, set aside the order dated 31.03.2004, passed by the Assistant Registrar of Trade Marks.",Facts
"(e) Aggrieved by the order dated 10.01.2005, the appellant has filed this appeal by way of special leave.",Facts
"Heard Ms. Anuradha Salhotra, learned counsel for the appellant and Mr. Sudhir Chandra, learned senior counsel for the respondent.",Ratio of the decision
"The sole question for consideration before this Court is whether the registration of the word ""RAMAYAN"" as a trade mark, being the name of a Holy Book of Hindus, is prohibited under Section 9(2) of the Trade Marks Act, 1999?",Ratio of the decision
Rival submissions:,Argument
"Learned counsel for the appellant submitted that the appellant was in the business of manufacturing, trading and marketing of incense sticks since 1981 and the respondent herein was a dealer of the appellant herein.",Argument
"The goods under the trade mark ""RAMAYAN"" have been advertised by him through various means including the publication of cautionary notices in newspapers.",Argument
"Learned counsel further submitted that through extensive use, wide advertisement and the excellent quality of the products, the trademark ""RAMAYAN"" and the carton in which the products are sold has become distinctive in such a manner that use of the same or similar trademark or carton by any other person will cause confusion and deception in the trade and amongst the public.",Argument
The sale was done through a network of dealers and distributors and the respondent herein was a dealer of the appellant herein.,Argument
"Learned counsel submitted that after the termination of dealership, the respondent herein started selling incense sticks under the trade mark ""RAMAYAN"" written in the same style and manner.",Argument
"Learned counsel further contended that the mere fact that the trade mark, being the name of a religious book, cannot be a sufficient ground for refusal of registration under Section 9(2) of the Act and is not based on evidence on record that the feelings of any section of the Hindus having been hurt by its use in relation to incense sticks.",Argument
She further submitted that the Assistant Registrar of Trade Marks rightly held that the impugned trade mark consists of device of crown and the word is capable of distinguishing the goods of the appellant herein and the trade mark is not included in the list of marks not registrable under the Act.,Argument
"She further claimed that it has already been proved before the Court of Assistant Registrar that the appellant was using the trade mark since 1981 and hence, is the prior user in comparison to the respondent.",Argument
"According to the learned counsel, the Board, totally misconstrued the observations of the Standing Committee in the Eighth Report on the Trade Marks Bill, 1993.",Argument
"Relying upon Clause 13.3 of the said report, it was submitted that even though the Committee had observed that ""any symbol relating to religious gods, goddesses, places of worship should not ordinarily be registered as a trade mark"", it specifically refrained from prohibiting registration of such marks.",Argument
It was further submitted that the Board has erroneously relied upon the decision of this Court in Registrar of Trade Marks vs Ashok Chandra Rakhit AIR 1955 SC 558 1955 Indlaw SC 88 by proceeding on the basis that the said case was an authority on the question that all religious names or symbols are prohibited from being registered whereas the fact of the matter is that this Court had merely upheld the concurrent findings of the Registrar and the High Court that the word 'SHREE' was incapable of distinguishing the goods of any one trader.,Argument
"The said case is also distinguishable by the fact that it was the invariable practice of the trade mark office not to register the word 'SHREE' but this is not so with the word ""RAMAYAN"".",Argument
"Relying upon a decision of this Court in Mumbai International Airport Private Limited vs Golden Chariot Airport and Another (2010) 10 SCC 422 2010 Indlaw SC 776, it is further submitted that the respondent herein had himself claimed the use of the identical mark and therefore, it did not lie in his mouth to object to the registration of the word in the name of the appellant.",Argument
She further contended that the Board ought to have seen that there are several cases which indicate that the use of the names of Hindu deities as trade mark is a common practice and no one has complained about the same being sensitive to Hindu religious sentiments for which reliance was placed on a decision of this Court in K.R. Chinna Krishna Chettiar vs Sri Ambal & Co. AIR 1970 SC 146 1969 Indlaw SC 170.,Argument
"Learned counsel also placed reliance on Corn Products Refining Co. vs Shangrila Food Products Ltd. 1960 (1) SCR 968 1959 Indlaw SC 211 in support of the submission that before the applicant can seek to derive assistance for the success of his application from the presence of a number of marks having one or more common features which occur in his mark also, he has to prove that those marks had acquired a reputation by user in the market.",Argument
"Learned counsel finally contended that the Board erred in law while setting aside the judgment of the Assistant Registrar of Trade Marks while holding adversely about its distinctiveness, the mark causing deception and not having been used in an honest manner.",Argument
"Learned senior counsel for the respondent contended that the impugned mark, being name of a religious book, cannot become the subject matter of monopoly for an individual.",Argument
"He further contended that the mark ""RAMAYAN"" is not a distinctive mark and is devoid of any distinctive character.",Argument
The mark is not capable of distinguishing the goods of one person from those of another.,Argument
"It was also contended that the mark ""RAMAYAN"" is not registrable since it is the name of a famous and well known religious book.",Argument
It was also claimed that more than 20 traders in Patna and many more are using the trade mark and thus it has become public juris.,Argument
"In support of the same, learned senior counsel placed reliance upon a decision of this Court in National Bell Co. vs Metal Goods Mfg. Co. (P) Ltd. and Another 1970 (3) SCC 665 1970 Indlaw SC 524.",Argument
"He further submitted that the impugned mark is identical with the respondent's mark ""BADSHAH RAMAYAN"" which is pending registration and the impugned registration will cause harassment to other traders and purchasing public would be bound to be confused and deceived.",Argument
Learned senior counsel finally claimed that the Board was right in setting aside the order dated 31.03.2004 passed by the Assistant Registrar of Trade Marks.,Argument
We have carefully gone through the relevant documents and perused the material on record.,Ratio of the decision
Discussion:,Ratio of the decision
"The appellant herein filed an application dated 25.08.1994 being no. 638073 B in class 3 for registration of a trade mark consisting of the word ""RAMAYAN"" with the device of crown in respect of incense sticks (agarbatties) and perfumeries etc.",Ratio of the decision
The appellant herein claimed the user since 01.01.1987.,Ratio of the decision
He further filed a request to rectify the user from 01.01.1981 which was allowed by the Assistant Registrar of Trade Marks.,Ratio of the decision
"While opposing the application in class 3 for registration of the trade mark, the respondent herein filed a notice of opposition under Sections 9, 11(a), 11(b), 11(e), 12(1) and 18(1) of the Act.",Ratio of the decision
"He claimed the use of the trade mark ""BADSHAH RAMAYAN"" prior to the appellant herein.",Ratio of the decision
"The respondent herein put forth an objection that the impugned mark, being name of a religious book, cannot become the subject matter of monopoly for an individual.",Ratio of the decision
He further added that his application for the registration of the same trade mark claiming user since 05.11.1986 is pending for registration.,Ratio of the decision
"The application was further opposed with the reasoning that it carries a large sentimental value for the people and therefore, no one can claim sole right to the use of such a word.",Ratio of the decision
"It was also admitted by the respondent herein that more than 20 traders in Patna are using the trade mark ""RAMAYAN"".",Ratio of the decision
"Finally, it was submitted that the impugned mark is identical with the respondent's mark ""BADSHAH RAMAYAN"" which is pending registration and the impugned registration will cause confusion among general public.",Ratio of the decision
"Though the Assistant Registrar of Trade Marks dismissed the application filed by the respondent herein, the Board set aside the said order after holding that the trade mark ""RAMAYAN"" is not distinctive of the goods of the appellant as it is being used as a mark for the same products by more than 20 traders in Patna and in different parts of the country and has become public juris and common to the trade.",Ratio of the decision
"In view of the above, it is relevant to mention Section 9 of the Act which reads as under:",Statute
Absolute grounds for refusal of registration (1) The trade marks,Statute
"(a) which are devoid of any distinctive character, that is to say, not capable of distinguishing the goods or services of one person from those of another person;",Statute
"(b) which consist exclusively of marks or indications which may serve in trade to designate the kind, quality, quantity, intended purpose, values, geographical origin or the time of production of the goods or rendering of the service or other characteristics of the goods or service;",Statute
"(c) which consist exclusively of marks or indications which have become customary in the current language or in the bona fide and established practices of the trade, shall not be registered:",Statute
Provided that a trade mark shall not be refused registration if before the date of application for registration it has acquired a distinctive character as a result of the use made of it or is a well known trade mark.,Statute
(2) A mark shall not be registered as a trade mark if,Statute
(a) it is of such nature as to deceive the public or cause confusion;,Statute
(b) it contains or comprises of any matter likely to hurt the religious susceptibilities of any class or section of the citizens of India;,Statute
(c) it comprises or contains scandalous or obscene matter;,Statute
"(d) its use is prohibited under the Emblems and Names (Prevention of Improper Use) Act, 1950 (12 of 1950).",Statute
(3) A mark shall not be registered as a trade mark if it consists exclusively of,Statute
(a) the shape of goods which results from the nature of the goods themselves; or,Statute
(b) the shape of goods which is necessary to obtain a technical result; or,Statute
(c) the shape which gives substantial value to the goods.,Statute
Explanation.,Statute
"For the purposes of this section, the nature of goods or services in relation to which the trade mark is used or proposed to be used shall not be a ground for refusal of registration.""",Statute
"This section stipulates that the trade marks which are devoid of any distinctive character or which consist exclusively of marks or indications which may serve in trade to designate the kind, quality, quantity, intended purpose, values, geographical origin or the time of production of goods or rendering of the services or other characteristics of the goods or service or which consist exclusively of marks or indications which have become customary in the current language or in the bona fide and established practice of the trade shall not be registered, unless it is shown that the mark has in fact acquired a distinctive character as a result of use before the date of application.",Ratio of the decision
"It also provides that a mark shall not be registered as trade marks if (i) it deceives the public or causes confusion, (ii) it contains or comprises of any matter likely to hurt the religious susceptibilities, (iii) it contains scandalous or obscene matter, (iv) its use is prohibited.",Ratio of the decision
"It further provides that if a mark consists exclusively of (a) the shape of goods which form the nature of goods themselves, or (b) the shape of goods which is necessary to obtain a technical result, or (c) the shape which gives substantial value of the goods then it shall not be registered as trade mark.",Ratio of the decision
"From Clause 13.3 of the Eighth Report on the Trade Marks Bill, 1993 submitted by the Parliamentary Standing Committee, we find that the Committee expressed its opinion that any symbol relating to Gods, Goddesses, places of worship should not ordinarily be registered as a trade mark.",Ratio of the decision
"However, the Committee did not want to disturb the existing trade marks by prohibiting their registration as it will result in a chaos in the market.",Ratio of the decision
"At the same time, the Committee trusted that Government will initiate appropriate action if someone complaints that a particular trade mark is hurting his religious susceptibilities.",Ratio of the decision
This report was presented on 21.04.1994.,Ratio of the decision
"When the report was presented, the appellant's trade mark had not been registered and the application filed by the respondent herein opposing its registration was dismissed only on 31.03.2004 by the Assistant Registrar of Trade Marks.",Ratio of the decision
"The word ""RAMAYAN"" represents the title of a book written by Maharishi Valmiki and is considered to be a religious book of the Hindus in our country.",Ratio of the decision
"Thus, using exclusive name of the book ""RAMAYAN"", for getting it registered as a trade mark for any commodity could not be permissible under the Act.",Ratio of the decision
"If any other word is added as suffix or prefix to the word ""RAMAYAN"" and the alphabets or design or length of the words are same as of the word ""RAMAYAN"" then the word ""RAMAYAN"" may lose its significance as a religious book and it may be considered for registration as a trade mark.",Ratio of the decision
"However, in the present case, we find that the appellant had applied for registration of the word ""RAMAYAN"" as a trade mark.",Ratio of the decision
"We also find that in the photographs, after adding ""OM's"" to the word ""RAMAYAN"", at the top and in between ""OM's and RAMAYAN"", the sentence, ""Three Top Class Aromatic Fragrance"", is also written.",Ratio of the decision
