text,label
What is given must be gathered from the language of the will in the light of the surrounding circumstances,Ratio of the decision

The learned counsel for the respondent followed the line adopted by Mr. Krishnaswami Iyengar,Argument

He also on the analogy of other wills and the decisions given on their terms wanted a decision on the construction of this will in his favour,Argument

"In the first instance, he placed reliance on a decision of the Madras High Court in Ratna Chetty v. Narayana swami Chetty (19I4",Precedent

26 M.L.J. 616,Precedent

"There the testator made a will in favour of his wife providing, inter alia",Precedent

"all my properties shall after my death be in possession of my wife herself and she herself should be heir to everything and Mutha Arunachala Chetty (nephew) and my wife, should live together amicably as of one family",Precedent

"If the two could not agree and live together amicably, my wife would pay Rs",Precedent

"4,000 and separate him",Precedent

and then my wife would enjoy all the remaining properties with absolute rights,Precedent

"If both of them would live together amicably, Muthu Arunachala Chetty himself would enjoy the properties which remain after the death of the widow",Precedent

"It was held upon the construction of the will that the nephew, who lived amicably with the widow till his death, had a vested interest at testator's death which could not be defeated by a testamentary disposition by the widow in favour of a stranger",Precedent

This decision only decides that case and is not very relevant in this enquiry,Ratio of the decision

Reference was also made to the decision of their Lordships of the Privy Council in Mst,Precedent

Bhagwati Devi v. Chowdry Bholonath Thakur (1874-75) 2 I.A 256,Precedent

This was a case of a gift inter vivos,Precedent

The gift to Mst,Precedent

"Chunderbutti, his wife, was in these terms: ""the remaining 'milkiut' and 'minhai ' 'estates, together with the amount of ready money, articles, slaves, and all household furniture I have placed in the possession of Mst",Precedent

"Chunderbutti Thakurain, my wife, to be enjoyed during her lifetime, in order that she may hold possession of all the properties and milkiut possessed by me, the declarant, during her lifetime, and by the payment of Government revenue, appropriate the profits derived therefrom, but that she should not by any means transfer the milkiut estates and the slaves; that after the death of my aforesaid wife the milkiut and household furniture shall devolve on Girdhari Thakur, my karta (adopted son",Precedent

The subordinate judge held that Chunderbutti got an estate for life with the power to appropriate profits and Girdhari got a vested remainder on her death,Precedent

The High Court took a different view and held that Chunderbutti took the estate in her character as a Hindu widow,Precedent

"The Privy Council on this will held as follows: ""Their Lordships do not feel justified, upon mere conjecture of what might probably have been intended, in so interpreting it as materially to change the nature of the estate taken by Chunderbutti",Precedent

"If she took the estate only of a Hindu widow, one consequence, no doubt, would be that she would be unable to alienate the profits, or that at all events, whatever she purchased out of them would be an increment to her husband's estate, and the plaintiffs would be entitled to recover possession of all such property, real and personal",Precedent

"But, on the other hand, she would have certain rights as a Hindu widow; for example, she would have the right under certain circumstances, if the estate were insufficient to defray the funeral expenses or her maintenance, to alienate it altogether",Precedent

"She certainly would have the power of selling her own estate; and it would further follow that Girdhari would not be possessed in any sense of a vested remainder, but merely of a contingent one",Precedent

"It would also follow that she would completely represent the estate, and under certain circumstances the statute of limitations might run against the heirs to the estate, whoever they might be",Precedent

Their Lordships see no sufficient reason for importing into this document words which would carry with them all these consequences and they agree with the subordinate judge in construing it according to its plain meaning,Precedent

These observations have to a certain extent relevance to the present case but on the facts this case is also distinguishable,Ratio of the decision

This will was couched in different language than the will in the present case,Ratio of the decision

"There was a clear prohibition, forbidding the widow to make any transfers of the milkiuit estates and the slaves",Ratio of the decision

Reference was also made to a decision of the Bombay High Court in Lallu v. Jagmohan (1898) I.L.R,Precedent

22 Bom,Precedent

The will there ran as follows,Precedent

"When I die, my wife named Suraj' is owner of that property",Precedent

"And my wife has powers to do in the same way as I have absolute powers to do when I am present, and in case of my wife's death, my daughter Mahalaxmi is owner of the said property after that",Precedent

"It was held that Suraj took only a life estate under the will, with remainder over to Mahalaxmi after her death and the bequest to Mahalaxmi was not contingent on her surviving Suraj, but that she took a vested remainder which upon her death passed to her heirs",Precedent

"After considering the rival contentions of the parties, we are of the opinion that no sufficient grounds have been made out for disturbing the unanimous opinion of the two courts below on the construction of this will",Ruling by Present Court

Both the learned counsel eventually conceded that the language used in the will was consistent with the testator's intention of conferring a life estate in the English sense as well as with the intention of conferring a Hindu widow's estate,Ratio of the decision

"It was, however, urged by Mr. Rajah Iyer that as no express or implied power of alienation for purposes of all legal necessities was conferred on the widow, that circumstance negatived the view that the testator intended to confer upon his widow a Hindu widow's estate as she would get in case of intestacy",Argument

"He also emphasized that the words of the gift over to the daughter as supporting his construction which was further reinforced by the words of the will limiting the widow's estate "" till your lifetime "" and of the omission from therein of words such as nialik etc., while describing the widow's estate",Argument

"Mr. Krisbnaswami lyengar, on the other hand, contended that the absence of any words in the will restricting her powers of alienation and putting a restraint on them, suggested a contrary intention and that the daughter's estate was described as coming into being after the estate of the widow and was not conferred on her simultaneously with the widow, and this connoted according to the notions of Hindus a full Hindu widow's estate",Argument

"In our judgment, there is force in the contention of Mr. Rajah Iyer for reasons already stated and in the result, therefore, we dismiss this appeal with costs",Ruling by Present Court

Appeal dismissed,Ruling by Present Court
"In this appeal, by special leave, the appellant challenges his conviction and sentence imposed upon him for offences under Sections 302, 201, read with Ss. 34 and 394, IPC For the offence of murder section 302 he has been sentenced to death and for the offences sections 201 and 394 he has been sentenced to undergo rigorous imprisonment for 7 years and 10 years respectively and the sentences have been directed to run concurrently.",Ratio of the decision
"The appellant's conviction for all these offences have been confirmed by the High Court of Allahabad, by its judgment dated November 13, 1967.",Ruling by Lower Court
"The prosecution case, in brief, was as follows.",Facts
"The appellant, who was well known to and was friendly with one Kalawati, an old woman of about 70 years of age, had called on her on the morning of September 19, 1966 and asked her to come to his Gher in the evening to take some maize which he had got ready for her.",Facts
"Kalawati went to the Gher of the appellant at about 4 p.m., the same day.",Facts
"The appellant, with the assistance of another person Kripal (since deceased) killed Kalawati by strangling her and removed from her body gold and silver ornaments which she was wearing.",Facts
The dead body which was first concealed in a heap of chaff in the Gher of the appellant was later on thrown into a well known as Chamaron Wala Kuan.,Facts
"The tenants living in the house of Kalawati, as well as some neighbors, noticed the disappearance of Kalawati the same night and made a search which was of no avail.",Facts
"Later in the night of September 19, 1966 the appellant is stated to have come to the house of Kalawati and given out that the latter had gone away to the village of Garhi along with Kripal and that he had been asked to sleeps in her house; but the tenants trued him away.",Facts
"The dead body of Kalawati was found floating in the well on the morning of September 20, 1966 and a report, Exhibit Ka 4, was lodged with the police by one Mahendra Dutt, P.W. 11, who was a near relation of the deceased.",Facts
"After inquest proceedings, the post mortem certificate is Exhibit Ka 1.",Facts
The opinion of the Doctor is that death of Kalawati is due to asphyxia as a result of strangulation.,Facts
"The Station Officer, Mowana Police Station, on receiving information from an informer suspected the appellant as the culprit and consequently arrested him on September 21, 1966.",Facts
"The appellant is stated to have taken the police officers as well as certain witnesses to his house and taken out from his locked box six gold bangles, for gold ear rings, a gold ear top and four silver lachchas.",Facts
"These articles were identified as the property of the deceased by P. Ws. 1, 2 and 10.",Facts
The defence of the accused was one of complete denial and he also disputed the truth of any ornaments having been produced by him from his locked box after his arrest.,Facts
He further pleaded that he had been falsely implicated in the case because of the hostility of police as he has refused to give evidence in a gambling case.,Facts
He also pleaded that he had been between whom and his father there had been bitter enmity in connection with certain election proceedings.,Facts
That Kalawati was the victim of murder is clear from the evidence of the Doctor P.W. 3.,Facts
He has spoke to the fact that the death of Kalawati was due to asphyxia brought about by strangulation.,Facts
"He has also mentioned in his post mortem certificate, Exhibit Ka 1, that there was a contusion 3 1/2""x 2 1/2"" extending from the right side of the neck near the collar bone on to the upper part of the chest, and the soft tissues of the neck had been ruptured both in front and at the sides of the neck, while the hyoid bone was fractured.",Facts
There were naught witnesses a such for the murder and for establishing the guilt of the appellant the prosecution relied entirely on circumstantial evidence.,Facts
The procession relied on the following circumstances as proving the cult of the accused :,Facts
"(1) That the accused was well acquainted with Mst.	Facts
Kalawati and often used to visit her house.	Facts
(2) That in the morning of 19 9 1966 the accused came to Kalawati's house and asked her to come to his enclosure in the evening to fetch some maize.	Facts
(3) That at 4 p.m. on 19 9 1966 Kalawati went to the enclosure of the accused and was seen with him there.	Facts
(4) That at about 10 or 11 p.m. on 19 9 1966 the accused came to Kalawati's house and told the tenants living there that Kalawati had gone off to Garhi with Kripal and that she had sent him to sleep at the house to guard the premises.	Facts
(5) That on 21 9 1966 gold and silver ornaments belonging to Kalawati, which she had been wearing when she went to the accused's enclosure two days earlier, were recovered from a locked box in the accused's house, the key of which was produced by the accused.",Facts
"P.Ws. 1, 4, and 11 have given evidence regarding circumstance no. 1.",Facts
P.W. 1 has spoken regarding circumstance no. 2.,Facts
P. W. 8 has given evidence regarding circumstance no. 3.,Facts
"This witness has stated that he saw on the evening of September 19, 1966 Kalawati in the company of the appellant and his associate Kripal.",Facts
"It may be stated that this was the last occasion when Kalawati was seen alive by any of the witnesses, because, on the next morning her dead body was found in the well.",Facts
"Circumstance no. 4 is spoken to by P.W. 1, her husband P. W. 4 and P.W. 7.",Facts
"The last circumstance, viz., the recovery of the ornaments belonging to the deceased on September 21, 1966 is spoken to by the two police officers, P. Ws. 14 and 17, as well as by P.W 6 who was one of the Panch witnesses of recovery, under Exhibit Ka 2, on September 21, 1966.",Facts
"Both the learned Sessions Judge, as well as the High Court on appeal, have accepted as true the evidence of the witnesses, referred to above, and have further held that the five circumstances, relied on by the prosecution, have been fully established.",Ruling by Lower Court
"Taking all the circumstances together in conjunction with the denial of the accused, the High Court, in agreement with the learned Sessions Judge, has become to the conclusion that it is the appellant who murdered Kalawati, robbed her of her ornaments and disposed of her body by throwing it into the well.",Ruling by Lower Court
"Mr. Nuruddin Ahmed, learned for the appellant, has urged two contentions : (i) that the finding regarding recovery of ornaments at the instance of the appellant, recorded by the learned Session Judge and the High Court, is perverse and that no reasonable person can come to that conclusion, on the evidence on record and (ii) that even if the recovery of ornaments at the instance of the appellant, is accepted as true, it does not lead to the conclusion that it is the appellant who committed the murder.",Argument
We are satisfied that neither of these contentions can be accepted.,Ratio of the decision
The conviction of the appellant in this case is based upon circumstantial evidence and the High Court and the Sessions Judge have accepted as true the evidence of the witnesses who speak to the various circumstances relied on by the prosecution.,Ratio of the decision
"When there are concurrent findings on facts, this Court does not, normally, taken upon itself the task of again reviewing the evidence; but, in view of the aback that the finding regarding recovery of ornaments is perverse, we have ourselves gone through to he evidence bearing on that aspect, and we are satisfied, notwithstanding certain minor discrepancies, that the evidence relating to the same is true and has been rightly accepted by the learned Sessions Judge and High Court.",Ratio of the decision
"The production of ornaments by the appellant, after his arrest, and which ornaments have been identified as belonging to the deceased, is a very strong circumstance in the chain of circumstances relied on by the prosecution.",Ratio of the decision
"The evidence relating to recovery of ornaments is furnished by the two police officers, P. Ws. 14 and 17 and the Panch witness P.W. 6.",Ratio of the decision
"According to this evidence, the appellant was arrested on September 21, 1966 by P.W. 14 and the appellant agreed to produce the ornaments of Kalawati which he had kept in his house.",Ratio of the decision
"The appellant took the place officers, P.W. 6 and one Bishamber Dayal to his house and, after opening the locked box which was in a room upstairs, he produced six gold bangles, four gold ear rings, one gold ear top and four silver lachchas.",Ratio of the decision
"These articles have been identified by P. Ws. 1, 2 and 10 as belonging to the deceased.",Ratio of the decision
These witnesses have spoken to the fact that these ornaments were normally worn by Kalawati.,Ratio of the decision
Minor discrepancies in the evidence of the witnesses regarding the recovery of the ornaments have been adverted to by the High Court.,Ratio of the decision
"Quite rightly, in the opinion, the High Court has taken the view that these discrepancies do not cast any doubt regarding the truth of the ornaments having been produced by the appellant after his arrest.",Ratio of the decision
Therefor we cannot accept the contention of Mr. Nuruddin Ahmed that the finding regarding the recovery of the ornaments at the instance of the appellant is perverse.,Ratio of the decision
"On the other hand, we are satisfied that the said finding properly and legitimately followed from the acceptance of the evidence of the two police officers and P W. 6.",Ratio of the decision
"No doubt, the mere recovery of the ornaments if it had stood by itself, without any other circumstance, may not lead to the one and only conclusion that it is the appellant who committed the murder.",Ratio of the decision
"But the prosecution has relied on for other circumstances, referred to above, and those circumstances, taken along with the circumstance regarding the recovery of the ornaments in our opinion, lead to the conclusion that it was the appellant who has committed the murder of Kalawati.",Ratio of the decision
The mode of evaluating circumstantial evidence has been stated by this Court in Hanumant vs the State of Madhya Pradesh and is as follows :,Precedent
"It is well to remember that in cases where the evidence is of a circumstantial nature, the circumstances from which the conclusion of guilt is to be drawn should in the first instance be fully established, and all the facts so established should be consistent only with the hypothesis of the guilt of the accused.	Precedent
Again, the circumstances should be of a conclusive nature and tendency and they should be such as to exclude every hypothesis but the one proposed to be proved.	Precedent
In other words, there must be a chain of evidence so far complete as not to leave any reasonable ground for a conclusion consistent with the innocence of the accused and it just be such as to show that within all human probability the act must have been done by the accused.",Precedent
This principle has been reiterated by this Court in several later decisions.,Ratio of the decision
"Applying the above principles, it is clear from the findings of the two Courts, that the circumstances from which the conclusion of guilt of the appellant is to be drawn have been fully established, and the chain of evidence accepted by both the Courts is also complete and does not leave any reasonable ground for a conclusion consistent with the innocence of the appellant.",Ratio of the decision
"Kalawati was last seen in the company of the appellant in his Gher on the evening of September 19, 1966 and the appellant has also deliberately attempted to mislead the tenants of Kalawati's house by stating that she had gone to the village of Garthi along with Kripal.",Ratio of the decision
"After his arrest, the production, by the appellant, of the ornaments worn by Kalawati is a vary clinching circumstance, which, taken along with the other circumstances, proves the complicity of the appellant in the murder of Kalawati.",Ratio of the decision
"To conclude, the appellant has been rightly convicted and sentenced for offences under Section 302, 201, read with Ss. 34 and 394, I.P.C. The appeal fails and is dismissed.",Ruling by Present Court
Appeal Dismissed.,Ruling by Present Court
"This appeal is brought by special leave from the award of the industrial tribunal, Bihar, dated 15 September, 1967.",Facts
"The appellant Tatanagar Foundry Company, Ltd., is incorporated in the State of West Bengal and owns two manufacturing establishments, one located at Belur in the State of West Bengal and the other in Jamshedpur in Bihar.",Facts
"The appellant carried on its business at Belur but has now closed its business at Jamshedpur with effect from 20 November, 1966.",Facts
"At the time of the closure the appellant employed 1, 360 workmen in its Jamshedpur establishment where it was producing cast iron pipes, specials and heavy grey iron castings including ingots, moulds, etc.",Facts
"On 20 September 1966, the appellant issued a notice in respect of its business at Jamshedpur that due to shortage of orders and other economic reasons, about 120 workmen are being retrenched and the Commissioner of Labour, Government of Bihar, Patna, was duly notified of the said retrenchment.",Facts
"On 22 September, 1966, the Labour Superintendent, Government of Bihar, Jamshedpur, held conciliation proceedings at which the appellant agreed to retain the services of fourteen of the retrenched workmen and the union agreed to the retrenchment of the remaining workmen.",Facts
"On or about 12 October, 1966, by a notice of the same date, the appellant desired to retrench about 400 workmen, but at the intervention of the Superintendent of Labour, the notice was temporarily withdrawn with a view to discuss the matter with the union.",Facts
Accordingly a meeting was fixed on 21 October 1966 between the appellant and the union at Jamshedpur but the said meeting could not take place.,Facts
"On 29 October, 1966, the appellant by a notice laid off nearly 600 workmen for want of supplies of good quality raw materials.",Facts
"In a letter dated 8 November 1966, the Superintendent of Labour, Jamshedpur, wrote that the general secretary of the union had put up a proposal for running the Jamshedpur establishment of the appellant on a co operative basis and requested Sri G. D. Agarwalla, director of the appellant, to place the matter before the board of directors of the appellant.",Facts
"At their meeting on 17 November, 1966, the board of directors considered the letter dated 8 November, 1966 of the Labour Superintendent and resolved that if the State Government should be desirous of running the Jamshedpur plant on a co operative basis Sri G. D. Agarwalla was authorized to conduct negotiations with the State Government of Bihar.",Facts
But no further communication was received from the Government of Bihar indicating its willingness or intention to run the Jamshedpur branch of the appellant.,Facts
"At its meeting on 17 November, 1966, the board of directors of the appellants considered the situation in the Jamshedpur plant and decided that it should be closed as early as possible and Sri Agarwalla was authorized to take necessary steps to effect the closure.",Facts
"Pursuant to the decision of the board of directors Sri Agarwalla issued a notice dated 19 November, 1966.",Facts
"By the said notice the workmen of the appellant were informed of its decision to close the business at Jamshedpur for good with effect from 21 November, 1966 for the reasons explained in the notice.",Facts
"All the workmen were also informed that their services were no longer required after 21 November, 1966 and the workers should consider themselves as discharged with effect from the said date.",Facts
"On 3 February 1967, the Government of Bihar referred the following dispute to the industrial tribunal, Bihar, for adjudication under section 10(1)(d) of the Industrial Disputes Act, 1947 (14 of 1947)",Statute
"Whether the closure of the Tatanagar Foundry Company, Ltd., Jamshedpur, is justified ? If not, to what relief, and compensation the workmen are entitled?",Ratio of the decision
"By its award, dated 15 September, 1967, the industrial tribunal held that it was satisfied that the closure of the Jamshedpur business of the appellant was not a closure but a lookout in the disguise of a closure and directed the reinstatement of the workmen with full wages for the period they have been out of employment.",Ruling by Lower Court
In support of this appeal it was argued in the first place that the industrial tribunal had no jurisdiction to go into the question whether the closure of the Jamshedpur business was justified or not for financial or other reasons.,Argument
"The contention was that the tribunal having found that the factory had in fact closed down, it had no jurisdiction to go into the question whether the closure could have been avoided.",Argument
"In our opinion, the argument is well founded and must be accepted as correct.",Ratio of the decision
"The distinction between a lockout and a closure has been explained by the decision of this Court in Express Newspapers, Ltd., vs Their workers and staff and other 1962 Indlaw SC 28 ].",Precedent
"It was pointed out in that case that in the case of a closure, the employer does not merely close down the place of business but he closes the business itself finally and irrevocably.",Precedent
A lockout on the other hand indicates the closure of the place of business and not closure of the business itself.,Precedent
In the present case the totality of facts and circumstances would lead to the conclusion that the undertaking at Jamshedpur was closed down completely and was a final and irrecoverable termination of the business itself.,Ratio of the decision
But the tribunal has come to a finding that the closure of the business was not bona fide but the closure was done in order to victimize the workmen.,Ruling by Lower Court
"As regards the financial position, the tribunal took the view that on the whole the financial condition of the company in 1966 has not worsened to such an extent as to reasonably constitute a good ground for closing the business altogether.",Ruling by Lower Court
It might have been a ground for reorganizing the company or rationalizing it by retrenchment or otherwise but it could not be a ground for winding up the business altogether.,Ratio of the decision
